post_id,comment,upvotes,time,is_submitter,model1,model2,model3,majority_votes
15ekh3h,"Greetings!

Right now, /r/Nepal needs your help. [We're doing our first demographics and Subreddit Health Feedback Survey.](https://docs.google.com/forms/d/e/1FAIpQLScw8Dd6IhcRXkze0AOMA-poapENJSpYmmOZrIJpbwJdXzIOaA/viewform?usp=sf_link) Let us together make /r/Nepal a better place for everyone!

If you do not wish to go through an entire survey, you can reach out to us here: [Moderation Feedback Megathread](https://www.reddit.com/r/Nepal/comments/14e161g/semiannual_moderator_feedback_and_qa_megathread/).

*I am a bot, and this action was performed automatically. Please [contact the moderators of this subreddit](/message/compose/?to=/r/Nepal) if you have any questions or concerns.*",1,31-07-2023 16:13,False,neutral,positive,positive,positive
15ekh3h,“Choro IT ma talent cha” -Bau,262,31-07-2023 21:11,False,neutral,neutral,positive,neutral
15ekh3h,This is so wholesome.,201,31-07-2023 16:54,False,positive,neutral,positive,positive
15ekh3h,My father would keep quiet about the matter and put the blame on me the second I touch the phone😭😂,266,31-07-2023 16:50,False,neutral,negative,negative,negative
15ekh3h,Man this is quite wholesome,78,31-07-2023 16:58,False,positive,positive,positive,positive
15ekh3h,Baba le aba taile ho xora J gareni ramro garr mero ta energy aba Sakina lagyo vandaa aakha baata aasu kasari rokne hunxa,51,31-07-2023 17:50,False,neutral,neutral,negative,neutral
15ekh3h,Always use protection kids!,93,31-07-2023 16:31,False,neutral,neutral,positive,neutral
15ekh3h,"This moment was really wholesome.I literally smiled while reading this.


How was his reaction when he got to know about actual price?",61,31-07-2023 17:00,False,positive,positive,positive,positive
15ekh3h,Can we like switch dads. Mine's broken.,19,31-07-2023 18:03,False,negative,negative,negative,negative
15ekh3h,My dad would rather stop using that phone and buy tiktike phone,12,31-07-2023 17:49,False,neutral,neutral,negative,neutral
15ekh3h,"Similar incident happened to me as well.

I still remember that day when I got selected for a renowned organization, my dad literally cried in the back after hearing the news. The happiness on his face was so evident!",11,01-08-2023 03:16,False,positive,positive,positive,positive
15ekh3h,Awwwww i melted.,7,31-07-2023 17:20,False,neutral,positive,positive,positive
15ekh3h,Jamma 100 ho bro tyatro 200 300 lagdeina,15,31-07-2023 17:17,False,neutral,neutral,neutral,neutral
15ekh3h,Wholesome!,7,31-07-2023 19:11,False,positive,neutral,positive,positive
15ekh3h,"Middle class haena bro, its lower middle class for me! Pheri ma rich vanna khojya haena , ma aafai estai low financial vaako family ho ! Hamro ni estai sano sano kura ma khusi hune moment dherai hunxa 😊😊",5,01-08-2023 01:16,False,neutral,neutral,negative,neutral
15ekh3h,"Hamro ta bau xora ko jhagada matra parxa ta yr:)
Varkhkharai ghar dekhi oralo morning walk hinda ukalo hidnu parxa vanera parya xa🙂🙂",3,01-08-2023 01:39,False,neutral,neutral,neutral,neutral
15ekh3h,"Wholesome ko meaning google garera aaiyo.   


THIS IS SO WHOLESOME.",3,31-07-2023 23:40,False,positive,neutral,positive,positive
15ekh3h,Thats so sweet 🥲,2,31-07-2023 18:13,False,positive,positive,positive,positive
15ekh3h,aww,2,31-07-2023 19:25,False,positive,positive,positive,positive
15ekh3h,"Thank you for sharing this. I was feeling down, this made me smile.",2,31-07-2023 22:29,False,positive,positive,positive,positive
15ekh3h,mero ta bau nai xainan to have wholesome moment like this.,2,01-08-2023 02:29,False,neutral,positive,positive,positive
15ekh3h,I can relate to your story so much! My dad is also someone who finds joy in the simplest things and has a heart of gold. I haven't told him enough how much I love and appreciate him. Thanks for sharing your story; it reminded me to express my love to my dad too. They truly deserve all the love and appreciation in the world!,2,01-08-2023 04:11,False,positive,positive,positive,positive
15ekh3h,once my father broke the screen protector and blamed the thunderstorm.,2,02-08-2023 08:33,False,negative,negative,negative,negative
15ekh3h,I dont understand nepalese what did he said?,0,01-08-2023 08:29,False,negative,negative,negative,negative
15ekh3h,"I am just saying, but that cheap replacement probably won't last long coz most of them are very very fragile. I had to replace my screen 4-5 times after the original one got cracked. I recommend you to give your dad a good screen replacement, which would outlast multiple cheap replacements.",-4,01-08-2023 00:40,False,negative,neutral,negative,negative
15ekh3h,Lolzzz,-2,31-07-2023 17:14,False,neutral,neutral,neutral,neutral
15ekh3h,What 200 ma sisa ferincha? Or are you talking about the tempered glass,-8,31-07-2023 17:29,False,neutral,neutral,neutral,neutral
15ekh3h,I am more saddened by how much the businesses can lie to sell the product and not suffer any consequences.,1,31-07-2023 22:22,False,negative,negative,negative,negative
15ekh3h,"Hacker hai bhai hacker , Isey kehte hai hacking",1,01-08-2023 00:01,False,neutral,neutral,neutral,neutral
15ekh3h,"vv cute anecdote. thank you for sharing, op! <3",1,01-08-2023 00:34,False,positive,positive,positive,positive
15ekh3h,Mutu chooyo boro,1,01-08-2023 00:42,False,neutral,neutral,positive,neutral
15ekh3h,As a son I just want to make my parent happy. I want that to be my motivation.,1,01-08-2023 00:48,False,positive,positive,positive,positive
15ekh3h,Thank you for sharing this wholesome moment with us.. ![gif](emote|free_emotes_pack|slightly_smiling),1,01-08-2023 03:48,False,positive,positive,positive,positive
15ekh3h,Bau is great.,1,01-08-2023 04:49,False,positive,positive,positive,positive
15ekh3h,cute,1,01-08-2023 05:12,False,positive,positive,positive,positive
15ekh3h,100 parxa kto ley 200 ta goji ma halni vayo,1,01-08-2023 05:24,False,neutral,neutral,neutral,neutral
15ekh3h,"If you can, get your dad's phone protected with a higher quality tempered glass. I put one from Remax that cost 1200 hola. It was in 2019. There's no noticeable scratch on the tempered glass and it has dropped quite a few times (Always had a phone case tho) and has never shattered like the 100 rs ones. And thank you for sharing this gem of a moment.",1,01-08-2023 07:10,False,positive,positive,neutral,positive
15ekh3h,hyackor bhoi hyackor,1,01-08-2023 11:04,False,neutral,neutral,negative,neutral
15ekh3h,Haha😂. My mom cracked her phone few days ago. I said i will fix her screen with my own money but she instead said “boru tyo paisa malai de”. Typical Nepalese parents. I had to fix her phone and also give her some extra cash to convince her to fix her phone.😅,1,01-08-2023 14:55,False,negative,neutral,negative,negative
15ekh3h,This is very wholesome. Needed this. Thank you.,1,01-08-2023 17:32,False,positive,positive,positive,positive
15ekh3h,That’s just adorable!,1,01-08-2023 17:33,False,positive,positive,positive,positive
15ekh3h,Bau ko dhuka haru chora lai nai tha hunu parxa,1,01-08-2023 17:38,False,neutral,neutral,negative,neutral
15ekh3h,Dad ❤️,1,02-08-2023 11:21,False,neutral,neutral,neutral,neutral
15ekh3h,It's safe for now 😂 but with many chinaphones it just breaks the screen. Say no to chinaphones. ( Samsung is the only durable in mid and low price ),1,02-08-2023 19:04,False,neutral,neutral,positive,neutral
15ekh3h,So precious![gif](emote|free_emotes_pack|slightly_smiling),1,04-08-2023 06:07,False,positive,positive,positive,positive
15ekh3h,I miss my old man. He was like this too lol.,1,11-08-2023 19:23,False,neutral,neutral,negative,neutral
15ekh3h,"Please note that every smile nd relief u put on your dad, means a lot m9re than we realize. U might think dad was happy because of price tag (which of course has some part to play) but we should note that whatever the price is, dads always find a way to cover those. So price is solely not the issue. He was happy because one of his many problems in a day was solved with a little helping hand from his child. One less thing to think about. CHEERS to the happy dad nd resourceful child. 🍻",1,19-08-2023 05:49,False,positive,positive,positive,positive
15ekh3h,I second this. Ngl I keep hearing this too,16,01-08-2023 07:20,False,neutral,neutral,neutral,neutral
15ekh3h,"Dad - 1, You - 0",85,31-07-2023 17:40,False,neutral,neutral,neutral,neutral
15ekh3h,Haha. Sometimes happen,9,31-07-2023 16:54,False,neutral,neutral,positive,neutral
15ekh3h,200-300 ko blame ho father lai happy garna lideu na blame 😂 kailekai jindagima..,4,01-08-2023 06:48,False,neutral,neutral,negative,neutral
15ekh3h,Dude same here 🥹🥹,2,01-08-2023 01:54,False,neutral,neutral,neutral,neutral
15ekh3h,I talked to my dad after weeks and my dad said the same thing to me. I was speechless for a long time.,1,01-08-2023 11:28,False,neutral,neutral,neutral,neutral
15ekh3h,Btw i smiled while reading your post. It's really wholesome imagining your dad smiling. Wish i could have that moment with my dad. (I live kinda far from him),30,31-07-2023 16:34,False,positive,positive,positive,positive
15ekh3h,And so is ur foreskin xd,3,01-08-2023 06:12,False,neutral,neutral,positive,neutral
15ekh3h,"only parents are not jealouse of your success, even ur sibling will be jealous of ur success at some point",4,01-08-2023 04:47,False,negative,negative,positive,negative
15ekh3h,Quality,1,01-08-2023 07:23,False,neutral,neutral,positive,neutral
15ekh3h,"Have to go maboudha & buy like 3-4 pcs, take them home & learn Applying from the sahuji, don't forget to take dust absorbing stickers",1,01-08-2023 15:13,False,neutral,neutral,neutral,neutral
15ekh3h,Happy cake day,1,01-08-2023 02:59,False,positive,positive,positive,positive
15ekh3h,I think it was indeed a thunderstorm.,1,02-08-2023 08:46,False,neutral,neutral,neutral,neutral
15ekh3h,"Screen futya haina re hau, protection matra k. Ek choti majja le padhi hernu na post...",5,01-08-2023 03:25,False,neutral,neutral,positive,neutral
15ekh3h,Yes,4,31-07-2023 17:43,False,positive,neutral,neutral,neutral
15ekh3h,"The content you have commented has been removed because your account seems to have been created sometimes in the past 6 hours. In order to avoid spam, comments by new accounts are automatically marked as spam. If this is a genuine comment we will approve this comment manually, which may take some time. If you wish to speak against this action please contact the moderators.

*I am a bot, and this action was performed automatically. Please [contact the moderators of this subreddit](/message/compose/?to=/r/Nepal) if you have any questions or concerns.*",1,01-08-2023 07:07,False,neutral,neutral,negative,neutral
15ekh3h,Did you just replied to your own comment replying to OP's post?? 😂,14,31-07-2023 18:20,False,neutral,neutral,neutral,neutral
15ekh3h,"&#x200B;

https://i.redd.it/4jbnsqxhkcfb1.gif",2,31-07-2023 18:53,False,neutral,neutral,neutral,neutral
15ekh3h,Blud how did you know?!,2,01-08-2023 06:25,False,neutral,neutral,neutral,neutral
15ekh3h,I think you are mistaken. He cried because of the joy. bhanxa ni khusi ko aashu. There is nothing like jealousy.,-1,01-08-2023 06:22,False,negative,negative,positive,negative
15ekh3h,"Quality ustai ho bro, 100-200-300 ko ma khassai difference hudeina kitw difference minimum 600-700 huna parxa, tmle 100-200 ma ferne temper glass

retailer lai 20-30 rs ma aauxa",2,01-08-2023 14:49,False,neutral,neutral,positive,neutral
15ekh3h,Happy cake day!,1,01-08-2023 03:52,False,positive,positive,positive,positive
15ekh3h,"The content you have commented has been removed because your account seems to have been created sometimes in the past 6 hours. In order to avoid spam, comments by new accounts are automatically marked as spam. If this is a genuine comment we will approve this comment manually, which may take some time. If you wish to speak against this action please contact the moderators.

*I am a bot, and this action was performed automatically. Please [contact the moderators of this subreddit](/message/compose/?to=/r/Nepal) if you have any questions or concerns.*",1,03-08-2023 03:30,False,neutral,neutral,negative,neutral
15ekh3h,"The content you have commented has been removed because your account seems to have been created sometimes in the past 6 hours. In order to avoid spam, comments by new accounts are automatically marked as spam. If this is a genuine comment we will approve this comment manually, which may take some time. If you wish to speak against this action please contact the moderators.

*I am a bot, and this action was performed automatically. Please [contact the moderators of this subreddit](/message/compose/?to=/r/Nepal) if you have any questions or concerns.*",1,01-08-2023 07:09,False,neutral,neutral,negative,neutral
15ekh3h,I wanted to keep it in my own comment thread and not make more comments.,5,01-08-2023 00:27,False,neutral,neutral,neutral,neutral
15ekh3h,He probably gave award to himself too 😆,9,31-07-2023 21:51,False,neutral,neutral,positive,neutral
15ekh3h,He didn’t say your parents were jealous tho. Read again :p,8,01-08-2023 06:32,False,neutral,neutral,negative,neutral
15ekh3h, khoi maile bujna nasakeko ho ki ke ho? Out of the sudden jealousy ko kura chai kata bata aayo yo topic ma???,1,02-08-2023 02:46,False,neutral,neutral,negative,neutral
15ekh3h,"He means,” bas parents matra ek ho jo aafno child ko success ma kailei jealous hudainan, hamro bhai baini samet life ko kunai point maa jealous hunxan.”",2,02-08-2023 03:05,False,negative,neutral,negative,negative
15ekh3h,Ehh.. okay sorry Mb.,1,02-08-2023 05:10,False,neutral,neutral,negative,neutral
