post_id,comment,upvotes,time,is_submitter,model1,model2,model3,majority_votes
gtrb0p,"Maybe the reason is because racism is Nepal is RELATIVE to geography. ie.  
\*\* Khas people and Hill Mongoloids racially discriminate against Madhesi in the hills.

\*\*Madhesi people racially discriminate against Khas and Hill Mongoloids in Terai.

\*\*Newar people racially discriminate everyone else in the valley.  
\*\*Hill Mongoloids racially discriminate against Khas people in the Eastern hills.  
Whereas,  
Black people are discriminated by white people everywhere in the United States.",85,31-05-2020 03:44,False,negative,negative,negative,negative
gtrb0p,I have not seen any Nepalese living in Nepal talking about it outside reddit.,34,31-05-2020 03:58,False,neutral,neutral,neutral,neutral
gtrb0p,Broo black lives matter.,36,31-05-2020 03:07,False,neutral,neutral,negative,neutral
gtrb0p,Yes this is true... i see some older people more rasists and teaching youths their skill,16,31-05-2020 03:29,False,negative,neutral,neutral,neutral
gtrb0p,Aru belama habsi vandei hepxa Randi ko twaat haru,17,31-05-2020 05:18,False,neutral,neutral,negative,neutral
gtrb0p,competition chalira ho ra?,9,31-05-2020 08:30,False,neutral,neutral,neutral,neutral
gtrb0p,"racism bhanda ni POLICE BRUTALITY HOLAA NEPAL MA BHATA AND LAAT MERICA MA GOLI (MOSTLY)

FOR NO BHOLI",3,31-05-2020 08:09,False,negative,negative,negative,negative
gtrb0p,I don't think thats the case at all. Very few in nepal know about black lives matter activism,3,31-05-2020 10:07,False,neutral,neutral,negative,neutral
gtrb0p,Its jati-sm here!,6,31-05-2020 03:45,False,neutral,neutral,neutral,neutral
gtrb0p,Every one's an alpha behind a screen and keyboard,4,31-05-2020 05:49,False,neutral,neutral,negative,neutral
gtrb0p,True.,4,31-05-2020 03:44,False,positive,neutral,positive,positive
gtrb0p,"All lives matter. In case of USA, racism is deep rooted.",3,31-05-2020 06:21,False,negative,negative,negative,negative
gtrb0p,"I remember when Nepal police murdered 50 madhesis, these so called progressive people choose to remain silent.  But when a black man gets murdered by some cop in the US these same people are like, “fuck the police”,  “fuck racism”, “black lives matter”.
Madharchod hypocrites haru.",7,31-05-2020 03:47,False,negative,negative,negative,negative
gtrb0p,Fucking retards trying to look cool in social media,1,31-05-2020 04:30,False,negative,negative,negative,negative
gtrb0p,Totally agreed,1,31-05-2020 04:29,False,positive,positive,positive,positive
gtrb0p,tru lmao,1,31-05-2020 05:39,False,neutral,neutral,positive,neutral
gtrb0p,Aah Mokey after using Asteroids... Dilan and Groovey must be so proud,1,31-05-2020 10:19,False,positive,positive,positive,positive
gtrb0p,"लुट्न सके लुट bhane jastai...

हेप्न सके हेप",1,31-05-2020 14:38,False,neutral,neutral,negative,neutral
gtrb0p,This proves that racism is everywhere on the earth.,1,31-05-2020 15:13,False,negative,negative,negative,negative
gtrb0p,Satya kuro,1,17-06-2020 14:11,False,neutral,neutral,neutral,neutral
gtrb0p,That is actually pretty true. Not only Nepalese but many people from various different Nations aswell.,1,18-06-2020 15:08,False,positive,neutral,positive,positive
gtrb0p,"Not only in case of racism but also in case of govt, people of our country are more interested in politics of other country.",1,20-06-2020 18:53,False,neutral,neutral,negative,neutral
gtrb0p,usa version of Mickey on steroids ?  that’s so hyper nationalist ME 🤭,1,31-05-2020 05:26,False,neutral,neutral,neutral,neutral
gtrb0p,Wow,0,31-05-2020 07:00,False,positive,neutral,positive,positive
gtrb0p,"I completely support the black lives matter protests currently. But I don’t like this being a race thing, partly because police shootings disproportionately effect the white community yet it’s serielized as a black-man-only issue. It’s tragic that George died, it’s right that they riot, but we need this accountability for every Duncan lemp and Breonna Taylor, why does police accountability have to be a race thing and gender thing. Hold police accountable. No matter what.",-2,31-05-2020 09:26,False,negative,neutral,negative,negative
gtrb0p,I think it's because Nepalis do not kill in the name of racism mostly.,-6,31-05-2020 05:24,False,negative,negative,negative,negative
gtrb0p,People need to stop behaving like SJWs,-2,31-05-2020 13:17,False,negative,negative,negative,negative
gtrb0p,"The thing is it’s not only black people, there is outright racism against hispanics, muslims, etc and there is also subtle racism against all other minorities (which includes nepali people).",27,31-05-2020 04:17,False,negative,negative,negative,negative
gtrb0p,"Here in the US we simplify it by just assuming skin tone = ethnicity.

It’s extremely problematic, Americans are confused. We even have lighter skin African people looking down on darker skinned Africans.",4,31-05-2020 13:21,False,negative,negative,negative,negative
gtrb0p,"Not disputing any of this, I’m here learning. But in the US race is also often separated by location with people making their own communities and boundaries. It doesn’t make the racism right, but it certainly makes it similar to your description. With blacks often staying in inner cities and whites often living in suburbs. If it is still racism between people in nepal based on location would it not be the same reasoning for America?",6,31-05-2020 09:29,False,negative,neutral,negative,negative
gtrb0p,"Its more like stereotypes and nepali are insensitive af. 
I think we should not put ideas of racism in nepali's mind thinking the riots and protests going on in US may  influence people here to cause same shit.",3,31-05-2020 11:37,False,negative,negative,negative,negative
gtrb0p,"People who come to US generally tend to be well educated and more empathetic, hence the difference.",3,31-05-2020 08:02,False,neutral,neutral,neutral,neutral
gtrb0p,you have not even touched the untouchabality. that is extreme of racism. we should respect all people. people always want to be segregated to people like themselves but that segregation should not undermine the humanity.,1,11-06-2020 12:05,False,negative,negative,negative,negative
gtrb0p,"Newar people have our own caste system. There are newar bramhins ie; buddhacharya, bajracharya other people in between and layers upon layers of other castes ending with newar dalits; shahi, jogi etc. 
I dont like it when people lump all newar people as wealthy, powerful and upper castes when there are dalit newars struggling like all the rest of the dalits as well.",1,18-06-2020 16:46,False,negative,negative,negative,negative
gtrb0p,Dub,0,31-05-2020 10:43,False,neutral,neutral,neutral,neutral
gtrb0p,try twitter,19,31-05-2020 04:12,False,neutral,neutral,neutral,neutral
gtrb0p,My newsfeed is all about George Floyd. 🤷‍♀️,15,31-05-2020 05:52,False,neutral,neutral,neutral,neutral
gtrb0p,People share this on insta stories.,26,31-05-2020 04:05,False,neutral,neutral,neutral,neutral
gtrb0p,"#BlackLivesMatter

Harek ko story ma",18,31-05-2020 04:41,False,neutral,neutral,negative,neutral
gtrb0p,No brother you need to check Twitter the issue was also trending in Twitter Nepal.,10,31-05-2020 05:57,False,neutral,neutral,neutral,neutral
gtrb0p,No it don't. No lives matter.,-26,31-05-2020 03:13,False,neutral,neutral,negative,neutral
gtrb0p,Wouldn't call it skill.,17,31-05-2020 04:10,False,neutral,neutral,positive,neutral
gtrb0p,Ohhh don't even get me started on Old people. People near me are accusing Muslims for spreading Corona in terai and are suggesting to ban people from terai to enter the valley,9,31-05-2020 06:01,False,negative,negative,negative,negative
gtrb0p,Twitter ko lekheko?,2,31-05-2020 10:56,False,neutral,neutral,neutral,neutral
gtrb0p,"black lives matter doesn't mean that black lives should be above every other race. It just means that black lives should be given equal rights & importance as white lives. If that isn't what you meant, ignore this.",1,18-06-2020 15:05,False,neutral,neutral,negative,neutral
gtrb0p,"TOTALLY DIFFERENT CONTEXT:  
First of all the Madhes andolan was not supported by even 70% of core Madhesis.  
Second, most of the people involved in Madhesh andolan were not general public but cadres of political parties.

Third, Black people in the US. are fighting for equality. The madhesh andolan demand was they get more seats in the parliament.(which would require the government to reduce seats to zero in low-populated hill districts.)

Another demand was to establish Hindi as the official language of Nepal when no ethnic groups of Nepal has hindi as their mother tongue.

Now, if George Floyd had died in a protest demanding Afrikaans to be the official language of US. or Minneapolis should get more senate states than other states, the case would be similar to Madhesh aandolan.

Please get your facts straight before coming out here spread your bullshit.",22,31-05-2020 05:17,False,neutral,neutral,negative,neutral
gtrb0p,"I didn't support the madesh andolan because they killed a child(What had the child done wrong ?), and his father too.

Do you support child murderers?

Plus, it's beacause of their andolan people living in the hills were cut off of gas, food, medicine.",2,01-06-2020 01:22,False,negative,negative,negative,negative
gtrb0p,"You sleeping under rock, dude? 5 people died because of that shit literally this week.",13,31-05-2020 05:29,False,negative,negative,negative,negative
gtrb0p,"Absolutely. I know some hispanics who are racist towards the blacks and muslims who are racist towards black or Nepalese who are racist towards the hispanics or the muslims who are racist towards white.  
The thing here is how a person who is in control of state resources and power uses it to murder a black person for entirely racial reason.

If my Hispanic neighbor is racist towards me because I am a Nepali, I don't care.

But if he has the power of state that depends on my taxes too and uses the system to oppress me, I will have a problem.",30,31-05-2020 05:24,False,negative,negative,negative,negative
gtrb0p,"First of all, Blacks are not a majority in any of the states. Their best position is in the DC. where they are like 50%.

African Americans have more populations in the Southern States where still the Whites tend to have a majority by a large margin. You would be surprised there are only 12% African Americans in the United States.  
Even in the cities where Blacks are majority like Detroit or New Orleans, its the white who will discriminate against Blacks with the power of the state.

In Madhesi majority cities like Janakpur, Rajbiraj, the Madhesi can easily oppress Khas minority. Unlike what you hear in the politically correct medias, the Madhesh is commanded by  regional zamindars who is usually a Kayastha or Madhesi Brahmin, on whose fields the Khas, Madhesi low-caste people work. During the Rana Regime, these zamindars would further pay taxes to the Rana bada-hakim.

This was the whole reason why Congress was successful in Madhesh. When King Mahendra came up with BhumiSudhar ain, which would restrict the zamindars to own only a certain amount of land, these zamindars went against it so supported the Congress. The zamindars could command all the people within his territory to support a certain candidate. Since communist also had the same agenda of Bhumi-Sudhar, they could never get a hold in the Madhesh.  


A closer comparison would be that of a Dalit. If in a village, there are 100 dailit family and 1 thakuri family, the more certain thing would be that the thakuri family would be oppressing the 100 dalit family. A dalit could have resentment against the thakuri family but you will never see a thakuri being oppressed by Dalit.",2,31-05-2020 20:42,False,neutral,,negative,neutral
gtrb0p,I'm not worried of that because riot that changes society For good is better than the decades of oppression.,1,11-06-2020 12:09,False,negative,neutral,negative,negative
gtrb0p,"There are hundreds of thousands of Nepalis living in the US. Many of us have families there. They put their knee on a black person this time. Who’s to say they won’t do this to a brown person given a chance? Are we really that removed from it?

I get it. There are issues in Nepal. But why can’t we be against racism in Nepal and elsewhere?",38,31-05-2020 06:04,False,negative,negative,negative,negative
gtrb0p,"You know, that's a terrible thing to say. Before we are Nepalese, we're humans. Doesn't matter if they're black or dalit, all lives matter. And how can you assume that the people who posted about the USA incident have no feelings towards the Dalit incident in Nepal? Posting in social media isn't everything.",17,31-05-2020 05:24,False,negative,negative,negative,negative
gtrb0p,"all people have right to live with dignity. you have to fight for dalit right, madheshi right don't mean you can't support for 'black rights matter'. oh is it 'black lives matter'?? but I like the first one.",1,11-06-2020 12:14,False,neutral,neutral,negative,neutral
gtrb0p,I saw it trending couple weeks back on fb.,1,17-06-2020 18:07,False,neutral,neutral,neutral,neutral
gtrb0p,Racism in general is a problem. Period.,1,17-06-2020 18:09,False,negative,negative,negative,negative
gtrb0p,Ok bro..husss.,1,31-05-2020 05:27,False,neutral,neutral,neutral,neutral
gtrb0p,Ohhh dankkkkk... dark bro ta IQ 130 jati hola.,29,31-05-2020 03:19,False,neutral,neutral,negative,neutral
gtrb0p,ahaahah yes,1,31-05-2020 11:30,False,positive,positive,positive,positive
gtrb0p,i am suprised you got the reference,0,31-05-2020 13:36,False,neutral,positive,positive,positive
gtrb0p,"The Hindi language demand is a genuine demand. Just like Nepali is the link language between all Pahadi groups in the hills (and now everywhere in Nepal), Hindi is the same among most Terai people because of the linguistic diversity there too.",-10,31-05-2020 05:49,False,neutral,neutral,positive,neutral
gtrb0p,If you understand the context and you’ll get the point,1,24-06-2020 18:20,False,neutral,neutral,neutral,neutral
gtrb0p,Lucy bro.....,6,31-05-2020 03:26,False,neutral,neutral,neutral,neutral
gtrb0p,"A woman wrote the same thing and a man wrote "" competition ho ra"" I'll get the link",2,31-05-2020 13:52,False,neutral,neutral,negative,neutral
gtrb0p,"Rajesh Pradhananga ji, So you must be one of those Kathmandu ma basne Newar who has never seen outside the valley like a Kua ko Bhyagguto.

Only the Madhesis from the city areas who have access to Hindi tv channels can understand Hindi and speak them.  
The Madhesis from inner part of Madhesh don't understand Hindi at all.   
A more understandable demand would be to put Maithili, bhojpuri, or Awadh as official language. But, guess what your Hindi loving Madhesi politicians did to the people who demanded Maithili should be recognized as official language?

They bombed the shit out of them and killed like a dozen people in one day following more stealth attacks to others.

Proof:  [http://archive.indianexpress.com/news/in-nepal-border-town-blast-death-of-an-activist-and-stage-star/945194/](http://archive.indianexpress.com/news/in-nepal-border-town-blast-death-of-an-activist-and-stage-star/945194/)",5,31-05-2020 06:04,False,neutral,negative,negative,negative
gtrb0p,I agree with you 100%. Hindi language is the link and for fuck sake its just a language I dont know why pahade gorkhali are so against it??,1,31-05-2020 11:21,False,negative,negative,negative,negative
gtrb0p,"He was killed because he was Dalit. They knew about him, their love story and had even filed a complaint before. And he went there on the request of his girlfriend, who wanted him to come and take her away. I have seen many of such incidents where boys go in group and get the bride. This is not new in western parts of Nepal (I am from west.) But even when the parents disagree, they don't beat them till the boys have to dive into a river to escape. This is because of caste.",3,31-05-2020 09:06,False,negative,negative,negative,negative
gtrb0p,"Whatever man, you're opinion. In my opinion, black people are killed on a daily basis all around the world, not just in the US whereas Nepalese minority face such problems less often and only in specific areas. The black incidents are inevitably getting more attention.
Personally, I just hate the mentality that whatever happens outside the country shouldn't bother us.",15,31-05-2020 06:24,False,negative,negative,negative,negative
gtrb0p,"Also, if this had happened to any other group like us Asian, Hispanic, European or native Americans it wouldn't have got this serious. It is actually native Americans who suffer more police brutality than any other group. But no. No none talks about them. The most crime against Asian are done by blacks but no one talks about it. Why? It's all political. 

If any Asian have been killed this way no one would bat an eye.",4,31-05-2020 08:52,False,negative,negative,negative,negative
gtrb0p,"no hauuu, i get it. i'm on twitter too",0,31-05-2020 15:12,False,neutral,neutral,neutral,neutral
gtrb0p,"Listen, you son of a bitch. I was born and brought up in Birgunj. With only looking at my surname you generalised my entire life and my ethnicity from your biased stereotype. You are exactly the kind of asshole who have been blinded by their privileges and the pseudo-nationalism.

And before you give me a lecture on about your knowledge of all this. Let me tell you, majority of my friends are from Madhesh and I have travelled across Madhesh myself for my research work in many villages from Morang/Sunsari all the way to Kailali/Kanchanpur. And linguistics was one of my course in university, granted I didn't study on the language dynamics of Madhesh in my college, but I do have more than a casual understanding of languages than you will ever even dream of. Many of these people you mentioned will not understand even the standard Bhojpuri or Maithili because there are many dialects within a small geographic area. Sure, not all may understand Hindi but it is a link language that at least the current generation understands, and something that many older folks will respond to as well. Many newer generation have also started speaking Nepali fluently, even in the remote villages, so even Nepali is taking up the spot as a link language and even replacing Hindi as the lingua franca. And in all this, I am not talking about a Hindi that is the standardised Hindi spoken in India's news channels, it is much more colloquial and contextual. Yes, a logical to do definitely is to make local languages as official languages, but the standard common language for a Maithil and an Awadhi speaker remains Hindi. And that is a fact.",3,31-05-2020 06:32,False,neutral,,negative,neutral
gtrb0p,"link between which groups? between ambassadors of Nepal and India?

Read the full thread above ignorant fuck.",2,01-06-2020 20:30,False,negative,negative,negative,negative
gtrb0p,"Since you don’t get it, in the context of what I was saying there is DISCRIMINATION against all those mentioned. Yeah I said “racism against hispanics, muslims, etc” but if you were to think within the context and stop being a bitch about little semantics you would understand that was me saying “racism against hispanics, discrimination against muslims, etc.” 

One thing you should know is that ppl who discriminate against muslims in America rarely know what their religion is about. They see someone with brown skin who look somewhat middle eastern they assume they are muslims. They see panjabi ppl with their turbans they assume they are muslims. 

There are certainly problems between ppl who disagree with one’s ideology and you’re right that ppl dislike one another over religion. But in the context of what I’m saying is that ppl in America barely know the religion. All they (they as in racist people ignorant of religion) see is that the person is brown with beard and thick eyebrows (in the case of a male) and they think oh that guy must be muslim and base their hate on that, not based on what the guy’s actual religion is. 

Either way, hate based on race or religion should not be normal (ofc unless certain religion’s ideology is to harm others in anyway shape or form, then that must be stopped).",1,24-06-2020 18:56,False,negative,negative,negative,negative
gtrb0p,"100%. When the attacks on Asians happened when the coronavirus started, majority of the attackers were from the black community.

Was there any riot or did anything happen over it?",6,31-05-2020 10:30,False,negative,negative,negative,negative
gtrb0p,"Ok, I dont have to give my ass more pain then",1,31-05-2020 15:19,False,negative,neutral,negative,negative
gtrb0p,"For a self-declared language expert like you, you seem to be totally ignorant on why a country adopts official language.  
So, Let me englighten a stupid fuck like you.

A country adopts official solely for recognition purposes. The United States doesn't have an official federal language. Your imbecile mind must deduce that people in the US. don't communicate at all.  
The state of Alaska has 20 official language even though everyone understands English. Guess why language-expert? For recognition.

Mr. Linguist Could you please tell me why Hindi is not the official language of United Kingdom? A significant amount of even 3rd and 4th generation South Asians communicate with each other in Hindi as a lingua franca.  
Of course you don't have an answer because your claims are baseless. 

I suggest Mr. Pradhananga to change his field of study to somewhere he is more connected. Its okay to be a failure brother. Who knows maybe there is something else for you in life?",7,31-05-2020 06:57,False,negative,negative,negative,negative
gtrb0p,"From where I come from I have not seen anything like that, but it is okay if you say so. But if we defy any crime against humanity just because we are not the eye witnesses, then there wouldn't be so many crimes. We see these things from far away from multiple sources, then we deducted something. Isn't that how news works?",1,31-05-2020 11:02,False,neutral,neutral,negative,neutral
gtrb0p,"Fair enough. Initially it sounded like Nepalese shouldn't care about foreign problems, but I agree. In fact, I think its the best that we stand up for everyone equally.",4,31-05-2020 07:13,False,neutral,neutral,neutral,neutral
gtrb0p,"lol ok, good day then. Arguing with fools is not my cup of tea.",0,31-05-2020 07:01,False,positive,negative,neutral,positive
gtrb0p,Obviously you have a problem of being unable to UNDERSTAND THE CONTEXT. My original comment was about discrimination against minorities within the United States.,1,24-06-2020 19:14,False,negative,negative,negative,negative
gtrb0p,"I wanna add to this. For people who live and have friends outside of Nepal, it’s hard to outright say Dalit lives matter without coming out as tone deaf. Because many around us don’t understand that term. If we talk about BIPOC voices in social media, I wish we could hope our friends back home would connect the dots and raise awareness for Dalit lives where they have personal reach 🙏🏽",2,10-06-2020 14:52,False,neutral,neutral,negative,neutral
gtrb0p,"I don't know which one is fool.  


Me who gave reasoning and answers against your claim or  


You who hit me with a ad hominem attack when you can't come up with a logic.",3,31-05-2020 07:06,False,negative,negative,negative,negative
gtrb0p,"Well I simply reject your highly biased and racist ""logic"", and will call it bullshit when it is. In my post I have not advocated that Hindi should be given official status, nor have I said that it should be promoted more than the native languages spoken in Terai. But if you get triggered even when someone brings you a basic fact that just like Nepali, Hindi too is considered as a lingua-franca by many people there, then my friend I may have hurt your fake and brittle national pride, and I'm so sorry for you!",1,31-05-2020 08:10,False,negative,negative,negative,negative
gtrb0p,"Had you focused more on your linguistic classes, you would know.

 [https://www.youtube.com/watch?v=IE5-Bw26goI](https://www.youtube.com/watch?v=IE5-Bw26goI)   
Ok. Tell me why Upendra Yadav gave a speech in Maithili and not Hindi in Janakpur? Wouldn't Janakpur be a melting pot city in Madhesh where people of different language and dialects like Bajjika, Bhojpuri, or Awadhi would live. But why didn't he choose to speak in Hindi.  
Ill tell a stupid fuck like you. Because he knows the people there are either not going to understand Hindi or people who wouldn't want him to speak Hindi undermining Maithil culture.

The only people who speak Hindi are your godmothers like Sarita Giri who are born in India and who doesn't have a Madhesi support or Indian agents like CK Lal.

Only the few times Madhesi leaders speak Hindi is in Kathmandu because they know the media is going to be there and they are not speaking to people rather to the government and when they don't want to speak in Nepali for reasons you know.  


Rajendra Mahato speaks to people of Janakpur in Maithili  
 [https://www.youtube.com/watch?v=Mah7bkwx15c](https://www.youtube.com/watch?v=Mah7bkwx15c) 

Why is that Mr.Linguist?  
Hridayesh Tripathi speaks to Madhesi people of Bhairahawa in Awadhi.  
 [https://www.youtube.com/watch?v=b3sDu0xFlxU](https://www.youtube.com/watch?v=b3sDu0xFlxU)   
Why is he not talking in Hindi, Mr Linguist?

Just because you Mr. Rajesh Pradhananga is a fan of Bollywood and has poster of Shahrukh Salman Khan in your room, doesn't mean everyone understand Hindi or identify themselves with it.",1,01-06-2020 20:29,False,neutral,,negative,neutral
