post_id,comment,upvotes,time,is_submitter,model1,model2,model3,majority_votes
ioni6r,"shoutout to emergency light, chelpark ink and mina cartoon.",80,08-09-2020 05:13,True,neutral,neutral,neutral,neutral
ioni6r,"This is the best one I have seen so far from Nepal. Great work with all the details! I see Mithoo, Moomin, Boost, Lakhey mask, Nepali calendar, emergency light, Nepali sabdakosh, CG branded lamp, Palpasa cafe on the bookshelf, a SAARC cup. Awesome!  Great job!!",47,08-09-2020 05:17,False,positive,positive,positive,positive
ioni6r,Arko pali kurshi ma towel pani rakhnu hai '),26,08-09-2020 05:46,False,neutral,neutral,negative,neutral
ioni6r,Damn! Is that boost mug with PewDiePie waves I see?,8,08-09-2020 10:01,False,neutral,negative,positive,neutral
ioni6r,Mina cartoon ko mina jastai chha ta,8,08-09-2020 09:40,False,neutral,neutral,negative,neutral
ioni6r,"I love that moomin is so popular in Nepal, I’m from Sweden and my boyfriend is from Nepal so moomin is like the only childhood memory we have in common haha",6,08-09-2020 10:56,False,positive,positive,positive,positive
ioni6r,"Best detail here is the lamp not working and having to use the ""emergency light"". So very well done!",10,08-09-2020 06:09,False,positive,positive,positive,positive
ioni6r,"Okay. This is the best one guys.
You can stop now. You're not gonna top this.",5,08-09-2020 09:59,False,neutral,positive,positive,positive
ioni6r,Where is the paint bucket ?,7,08-09-2020 07:43,False,neutral,neutral,neutral,neutral
ioni6r,"I think my favorite part about the image is either details on her - fuli, chulto maa rato riboon or the books on the shelves that I personally happen to love - Tapan, Palpasa Cafe.",3,08-09-2020 12:07,False,positive,positive,positive,positive
ioni6r,"Sanu maya on screen, Boost gift, emergency light, ink pot, Flag of Nepal. I miss those days.",4,08-09-2020 07:45,False,neutral,neutral,positive,neutral
ioni6r,Love this art ... ❤️,2,08-09-2020 09:35,False,positive,positive,positive,positive
ioni6r,"Cup with SAARC logo
Nepali Sabdakosh 😳
Wow",2,08-09-2020 10:07,False,neutral,positive,positive,positive
ioni6r,"Seeing पल्पसा क्याफे made me happy.
Such a wonderful book and this post as well",2,08-09-2020 10:09,False,positive,positive,positive,positive
ioni6r,I laughed harder than I should have after looking at the thin nepali sabdakosh.,2,08-09-2020 11:33,False,neutral,positive,negative,neutral
ioni6r,Euta Sticker nikaaleko cold drink ko jumbo / 1.5 liter ko bottle xutyo,2,08-09-2020 12:05,False,neutral,neutral,neutral,neutral
ioni6r,Mina!!! Is that you????,2,08-09-2020 13:16,False,neutral,neutral,neutral,neutral
ioni6r,"Boost cup ma pen 
Is relatable",4,08-09-2020 06:44,False,neutral,positive,positive,positive
ioni6r,That lantern is the real touch. I remember so many nights studying with only that lantern when the power was cut.,2,08-09-2020 06:52,False,neutral,negative,negative,negative
ioni6r,"Mina ra minako sunga, boost, CG, Chelpark ink",1,08-09-2020 10:16,False,neutral,neutral,neutral,neutral
ioni6r,Kosaile YouTube ma Nepali logo geet halde hunthyo,1,08-09-2020 10:18,False,neutral,neutral,neutral,neutral
ioni6r,"Moomin sticker, papasa cafe book, and durbar square outside the window looks cool. Nice.",1,08-09-2020 10:31,False,positive,positive,positive,positive
ioni6r,I can see that she lives near Pashupathinath temple and there is a parrot on her window and is that supposed to be Kermit the frog hanging on the lamp?,1,08-09-2020 10:42,False,neutral,neutral,neutral,neutral
ioni6r,"CG ko nabalne lamp, byakaran ko kitaab and moomin sticker. Such interesting inserts.",1,08-09-2020 12:08,False,neutral,positive,positive,positive
ioni6r,This is beautiful.,1,08-09-2020 14:18,False,positive,positive,positive,positive
ioni6r,This one is sponsored by boost ?,1,08-09-2020 17:02,False,neutral,neutral,positive,neutral
ioni6r,"Moomin is super well known here actually, I think mainly from the animated series but I’m not sure about the comics. Even today a lot of people collect moomin mugs and other products, which are quite expensive even",1,08-09-2020 17:07,False,positive,neutral,neutral,neutral
ioni6r,Hey! OP can I use this image on my youtube lo-fi music??,1,23-11-2020 15:10,False,neutral,neutral,neutral,neutral
ioni6r,Amazing! Loved the small details.,1,08-09-2020 07:26,False,positive,positive,positive,positive
ioni6r,Loved all the small details and saw new one in each zoom. Brilliantly done!,1,08-09-2020 08:03,False,positive,positive,positive,positive
ioni6r,Im happy with everything but the thickness of Nepali Sabdakos in ur art is kinda uncomfortable,1,08-09-2020 08:49,False,neutral,neutral,neutral,neutral
ioni6r,"Everything has attention to detail except the nepali sabdakosh book isn't that thin. The book is 3-4 times the size of what you have made it look. 
Very excellent work indeed",1,08-09-2020 08:58,False,positive,positive,positive,positive
ioni6r,"This is so good! Love the details (Moonmin, Lakhey, Sanumaya). Good job, mate!",0,08-09-2020 05:06,False,positive,positive,positive,positive
ioni6r,"Now that's a good one, a lot of tiny references, love it.",0,08-09-2020 05:08,False,positive,positive,positive,positive
ioni6r,Awesome work !,0,08-09-2020 05:08,False,positive,positive,positive,positive
ioni6r,Kun sofware use garnu hunxa daju.,0,08-09-2020 05:17,False,neutral,neutral,neutral,neutral
ioni6r,Beautifully done.,0,08-09-2020 05:39,False,positive,positive,positive,positive
ioni6r,Amazing work.,0,08-09-2020 05:51,False,positive,positive,positive,positive
ioni6r,niceee,0,08-09-2020 06:01,False,positive,positive,positive,positive
ioni6r,Tibetian prayer flags on the walls and it would be perfect.,0,08-09-2020 06:33,False,positive,positive,positive,positive
ioni6r,Nice!,0,08-09-2020 06:57,False,positive,positive,positive,positive
ioni6r,Great job with the small details man!!!. Love it.,18,08-09-2020 06:42,False,positive,positive,positive,positive
ioni6r,Sanu maya too,6,08-09-2020 09:16,False,neutral,neutral,neutral,neutral
ioni6r,Nostalgia hit me a bit somewhere,3,08-09-2020 13:42,False,neutral,neutral,neutral,neutral
ioni6r,and that SLC preparation book on the shelf.,17,08-09-2020 05:41,False,neutral,neutral,neutral,neutral
ioni6r,Is Moomin a big thing in Nepal? I was quite surprised and happy to see a mural with those familiar characters in Pokhara last year but newer thought they would be that famous.,6,08-09-2020 07:18,False,positive,positive,positive,positive
ioni6r,This an edit of the original one so original already had pew red waves I guess,5,08-09-2020 10:08,True,neutral,neutral,neutral,neutral
ioni6r,"Intention tyei thyo haha, das why tyo parrot ni sangai cha",8,08-09-2020 09:44,True,neutral,neutral,neutral,neutral
ioni6r,"As a Finn, I didn't know Moomins were popular also in Sweden.",1,08-09-2020 12:41,False,neutral,neutral,neutral,neutral
ioni6r,moomin as sticker on the keyboard.,2,08-09-2020 12:13,False,neutral,neutral,positive,neutral
ioni6r,want to re-edit just to add this,2,08-09-2020 12:18,True,neutral,neutral,neutral,neutral
ioni6r,"bro lurk gardo raichas, dar lagcha lurker haru dekhera",1,08-09-2020 14:45,True,neutral,neutral,negative,neutral
ioni6r,"Also palpasa cafe, lakhe",1,08-09-2020 10:16,False,neutral,neutral,neutral,neutral
ioni6r,"This a edit of the original so I took way too much time with it, thought I did enough and left things remaining from the original.",1,08-09-2020 10:45,True,negative,neutral,negative,negative
ioni6r,Kathmandu nagarpalika ko flag,1,08-09-2020 07:02,True,neutral,neutral,neutral,neutral
ioni6r,Happy CakeDay dude,1,08-09-2020 08:44,False,positive,positive,positive,positive
ioni6r,photoshop broda,2,08-09-2020 05:20,True,neutral,neutral,neutral,neutral
ioni6r,"Malai daju bhanera na bolau na ples, how am I daju (༎ຶ ෴ ༎ຶ)",0,08-09-2020 06:14,True,neutral,neutral,neutral,neutral
ioni6r,She looks more newar to me,2,08-09-2020 06:58,False,neutral,neutral,positive,neutral
ioni6r,[talking about her??](https://youtu.be/dQw4w9WgXcQ),4,08-09-2020 07:09,False,neutral,neutral,neutral,neutral
ioni6r,"Moomin, Palpasa cafe, chelpark,",13,08-09-2020 07:32,False,neutral,neutral,neutral,neutral
ioni6r,"Don't think newer gen people will know of it but it used to be, it's prolly the only cartoon to have ever aired Nepali dubbed here if we don't count ""Meena"" cartoon by UNICEF.",12,08-09-2020 07:28,True,neutral,neutral,neutral,neutral
ioni6r,"Oh yes, Moomin was one of the few cartoons that were aired on Nepal Television in the 90s. There weren't many tv channels at that time so many Nepalis grew up watching Moomin.",6,08-09-2020 08:14,False,positive,positive,neutral,positive
ioni6r,She (Tove Jansson) was a Swedish speaking Finn and wrote the Moomin books in her mother tongue. Moomins naturally spread both to Finland and Sweden.,1,08-09-2020 13:55,False,neutral,neutral,neutral,neutral
ioni6r,Missed that.,1,09-09-2020 12:36,False,neutral,neutral,negative,neutral
ioni6r,Kina bro 😂😂,2,08-09-2020 18:17,False,neutral,neutral,neutral,neutral
ioni6r,Saarc mug,1,08-09-2020 10:17,False,neutral,neutral,negative,neutral
ioni6r,Link to the original?,1,08-09-2020 10:46,False,neutral,neutral,neutral,neutral
ioni6r,Nepali calender up there too.,3,08-09-2020 14:00,False,neutral,neutral,neutral,neutral
ioni6r,You should be amazed that Beyblade was also aired in Nepali TV for a short stint,8,08-09-2020 08:59,False,neutral,positive,positive,positive
ioni6r,I was very weirded out when I tried to watch moomin as i watch anime with Japanese voice and English subs.......,2,08-09-2020 13:44,False,neutral,neutral,neutral,neutral
ioni6r,There was Barbapappa also,4,08-09-2020 08:14,False,neutral,neutral,neutral,neutral
ioni6r,upto late 2000s i think.,2,08-09-2020 12:09,False,neutral,neutral,neutral,neutral
ioni6r,It is natural that they did. I just haven't seen them marketed on that side of the bay. Was it more the animated series or the books and comics?,1,08-09-2020 13:59,False,neutral,neutral,positive,neutral
ioni6r,Sanumaya pani raxa,1,08-09-2020 10:18,False,neutral,neutral,positive,neutral
ioni6r,"It's everywhere my g. I'm on my phone rn, you can google lo-fi girl.",2,08-09-2020 10:47,True,neutral,neutral,neutral,neutral
ioni6r,"haina daju, sathi ho",0,08-09-2020 06:37,True,neutral,neutral,positive,neutral
ioni6r,"wut, this some news to me",5,08-09-2020 09:04,True,neutral,neutral,neutral,neutral
ioni6r,"The original one is not the japanese one, but in Finnish-Swedish (Suomi perkele torille)",2,09-09-2020 10:41,False,neutral,neutral,neutral,neutral
ioni6r,"Yes, moomin is super well known here in Sweden, mainly from the animated series I think but I’m not sure about the comics. Still today a lot of people collect moomin mugs and other products ☺️",1,08-09-2020 17:13,False,positive,positive,neutral,positive
ioni6r,Ok,1,08-09-2020 10:53,False,neutral,neutral,neutral,neutral
ioni6r,"lol Image channel used to show Teenage Mutant Ninja Turtles. Also, I remember seeing Transformers G1 on Kantipur or something.",1,05-12-2020 16:43,False,neutral,neutral,negative,neutral
ioni6r,Oh....there was a recent movie that I watched and it was on Japanese,1,09-09-2020 11:45,False,neutral,neutral,neutral,neutral
ioni6r,huss sir no problemo,0,08-09-2020 06:58,True,neutral,negative,neutral,neutral
