post_id,comment,upvotes,time,is_submitter,model1,model2,model3,majority_votes
iy99g8,u/KP-Oli (definitely the real one) standing outside your window.,34,23-09-2020 13:01,False,neutral,neutral,neutral,neutral
iy99g8,"Damn you , I was tired of the same deepfake videos. This one is fucking good. The lip sync is damn good. 

Take my upvote , fellow redditor",25,23-09-2020 16:56,False,negative,neutral,neutral,neutral
iy99g8,"God level deep fake


Great work!!",16,23-09-2020 15:43,False,positive,positive,negative,positive
iy99g8,How did you make this?,12,23-09-2020 15:48,False,neutral,neutral,neutral,neutral
iy99g8,I had one free award and i gave it to you lmao this is awesooomee,10,23-09-2020 16:34,False,positive,positive,positive,positive
iy99g8,[Youtube link](https://youtu.be/IJlQRkkUDAc),8,23-09-2020 12:38,True,neutral,neutral,neutral,neutral
iy99g8,"Swear to god, I was just thinking about making this. Lmfao!",13,23-09-2020 15:14,False,neutral,neutral,negative,neutral
iy99g8,I came looking for copper but I found gold,5,23-09-2020 17:48,False,neutral,neutral,neutral,neutral
iy99g8,This is the most wholesome thing I have ever watched.,10,23-09-2020 15:27,False,positive,positive,positive,positive
iy99g8,"Yo aauwa auwa tumshe he tumshe pyar, hindi geet le yehi bata choreraicha lahh mya",5,23-09-2020 19:05,False,neutral,neutral,neutral,neutral
iy99g8,I dunno what I should feel about this.,4,23-09-2020 16:03,False,neutral,neutral,positive,neutral
iy99g8,dame dane flashbacks,4,23-09-2020 16:28,False,neutral,neutral,negative,neutral
iy99g8,[\*le 20yr old me](https://imgur.com/RPTTVID),5,23-09-2020 16:48,False,neutral,neutral,negative,neutral
iy99g8,Thanks for the nightmares..,3,23-09-2020 18:01,False,negative,negative,negative,negative
iy99g8,Bahahaahahahahaha,4,24-09-2020 01:28,False,neutral,positive,positive,positive
iy99g8,Cute,3,23-09-2020 16:40,False,positive,positive,positive,positive
iy99g8,Damn! Awesome. You goooood.,3,23-09-2020 16:45,False,positive,positive,positive,positive
iy99g8,Awesome work bro! What template did you use?,3,23-09-2020 21:58,False,positive,positive,positive,positive
iy99g8,No worries about getting SWAATTED. The Oli's cyber crime patrol won't get it anyways.,3,23-09-2020 22:20,False,negative,negative,negative,negative
iy99g8,"This one is really good, it looks like they are actually singing it, why doesn't this have more upvotes and views?",3,23-09-2020 23:31,False,positive,positive,positive,positive
iy99g8,Can you put a Nepali song about Samantibaad and have Prachanda and his company sing to it?,3,24-09-2020 02:05,False,neutral,neutral,neutral,neutral
iy99g8,"This one was actually funny mate.

By the way whats the template video(04.mp4) you used for this?",3,24-09-2020 02:22,False,positive,neutral,positive,positive
iy99g8,"Dyaaanng thats impressive, amusing  and insanely funny all at the same time 😂❤️",3,24-09-2020 02:23,False,positive,positive,positive,positive
iy99g8,Taile Noice ta?,3,24-09-2020 02:52,False,neutral,neutral,neutral,neutral
iy99g8,"here take an upvote, i was initially about to downvote thinking it to be same old synced with japanese song, how wrong was i, lol, good one OP.",6,23-09-2020 14:53,False,positive,neutral,neutral,neutral
iy99g8,Awesome work..but AI are real threat to the world.,2,24-09-2020 02:56,False,positive,positive,positive,positive
iy99g8,"Who else thought that this was gonna be Dame-Da-Ne aka Baka Metai?😂😂

Anyways that was wholesome! 🥰😍😘",2,24-09-2020 05:45,False,neutral,neutral,positive,neutral
iy99g8,Loosing my shit when kulman's head go 'dodododododo' with synth.,2,24-09-2020 06:42,False,negative,negative,negative,negative
iy99g8,Something I really enjoyed in r/Nepal after a very long time. Thanks.,2,24-09-2020 15:41,False,positive,positive,positive,positive
iy99g8,Not swatted but you will definitely get CBI’d,2,03-11-2020 13:36,False,neutral,negative,negative,negative
iy99g8,Dame dane 2.0?,2,23-09-2020 16:17,False,neutral,neutral,neutral,neutral
iy99g8,u/Vredditdownloader,2,23-09-2020 16:20,False,neutral,neutral,neutral,neutral
iy99g8,Hahahahahqhqhaha m so ded how do i download this,1,24-09-2020 03:15,False,neutral,neutral,neutral,neutral
iy99g8,This is peak r/Nepal and we can only go downhill,1,24-09-2020 03:24,False,negative,negative,neutral,negative
iy99g8,GitHub herdimna bro,1,24-09-2020 04:15,False,neutral,neutral,neutral,neutral
iy99g8,r/nepal at its peak,1,24-09-2020 04:25,False,neutral,neutral,neutral,neutral
iy99g8,"You just made my day man😂😂
That's hilarious 🤣🤣😂😂",1,24-09-2020 04:40,False,positive,positive,positive,positive
iy99g8,"Now, this is quality.",1,24-09-2020 06:39,False,neutral,neutral,positive,neutral
iy99g8,"NGl I was expecting a baka mitai deepfake, still impressed nevertheless.",1,24-09-2020 10:08,False,neutral,positive,positive,positive
iy99g8,Lol you think that they will take me before i finish this senten,30,23-09-2020 16:56,True,neutral,neutral,neutral,neutral
iy99g8,"am glad you liked it, fellow redditor",11,23-09-2020 17:03,True,positive,positive,positive,positive
iy99g8,Thanks,4,23-09-2020 16:10,True,positive,neutral,positive,positive
iy99g8,"It is made by using a notebook on google collab. 

[Here if you wanna try](https://colab.research.google.com/github/AliaksandrSiarohin/first-order-model/blob/master/demo.ipynb#)",18,23-09-2020 16:08,True,neutral,neutral,neutral,neutral
iy99g8,"Thank you person who had one free award   


\*on a serious note I really appreciate that",7,23-09-2020 16:36,True,positive,positive,positive,positive
iy99g8,Man i also thought what if someone made before me lol,7,23-09-2020 15:58,True,neutral,neutral,negative,neutral
iy99g8,What's stopping you now,4,23-09-2020 15:58,False,neutral,neutral,neutral,neutral
iy99g8,G O L D,4,24-09-2020 02:42,True,neutral,neutral,neutral,neutral
iy99g8,Thanks lol,4,23-09-2020 16:06,True,positive,positive,positive,positive
iy99g8,"Man, you'd be surprised how much the bollywood copy pastes from American music industry!",2,24-09-2020 07:48,False,negative,negative,positive,negative
iy99g8,F E E L   T H E   P A I N,8,23-09-2020 16:11,True,neutral,neutral,neutral,neutral
iy99g8,BRUHHHH,3,23-09-2020 17:02,True,neutral,neutral,neutral,neutral
iy99g8,Welcome,2,24-09-2020 02:41,True,positive,positive,positive,positive
iy99g8,Cahahahahahaha,3,24-09-2020 02:40,True,positive,neutral,positive,positive
iy99g8,Thanks Explorer for exploring my reddit post,3,24-09-2020 02:45,True,positive,positive,positive,positive
iy99g8,I coudn't find the song can you like maybe send the link,2,24-09-2020 02:40,True,neutral,neutral,neutral,neutral
iy99g8,Thanks Mate,3,24-09-2020 02:44,True,positive,positive,positive,positive
iy99g8,aba ekxin ma nouxu,3,24-09-2020 02:53,True,neutral,neutral,neutral,neutral
iy99g8,DAME!! DAME!!,5,23-09-2020 15:03,False,neutral,neutral,neutral,neutral
iy99g8,"No, it is Damedane 6.9",2,24-09-2020 02:44,True,neutral,neutral,neutral,neutral
iy99g8,Rip.,7,24-09-2020 01:45,False,neutral,neutral,negative,neutral
iy99g8,What video did you use as the driving video? That elongation of Kul Man just kills it lmao,3,23-09-2020 21:27,False,neutral,neutral,neutral,neutral
iy99g8,They'll announce his corona death tomorrow,7,24-09-2020 05:44,False,negative,negative,negative,negative
iy99g8,He ded?,1,24-09-2020 10:36,False,neutral,neutral,neutral,neutral
