post_id,comment,upvotes,time,is_submitter,model1,model2,model3,majority_votes
j1cnx9,"We don't use CGI. CGI is for pussies.

For a split second, you can literally see their faces.",95,28-09-2020 14:41,False,neutral,neutral,negative,neutral
j1cnx9,"""Trouble....girl in trouble""",42,28-09-2020 14:46,False,negative,neutral,negative,negative
j1cnx9,Damn how did they train those tigers so good?,33,28-09-2020 14:53,False,positive,neutral,positive,positive
j1cnx9,Is there any cult following of nepali movies for the sake of guilty pleasure. I would actually watch movies that are so bad that its good.,46,28-09-2020 14:32,False,neutral,negative,positive,neutral
j1cnx9,The tigers are paid actors,15,28-09-2020 21:49,False,neutral,neutral,positive,neutral
j1cnx9,Kinda enjoyed it. Ngl.,14,28-09-2020 15:08,False,positive,positive,positive,positive
j1cnx9,someone should start a kollywoodrealism subbreddit for realss haha. this is gold.,11,28-09-2020 17:35,False,neutral,neutral,positive,neutral
j1cnx9,"Out here in the wild a lonesome and helpless homosapien walks and is met by four afro-asiatic tigers. They are easily recognizable breed due to their distinct legs feature, where there knees bend forward like a normal human, unlike animals which bend backwards. This is due to evolution where they gave up their running and hunting skills to learn new Karate moves to remain a cool breed. Although these appear to be novice as our protagonist easily gives them a ram dhulai.",17,28-09-2020 16:31,False,neutral,neutral,positive,neutral
j1cnx9,leonardo dicaprio did same with bear and won oscar,7,29-09-2020 01:44,False,neutral,neutral,positive,neutral
j1cnx9,Girl in Trouble,5,28-09-2020 16:36,False,negative,neutral,negative,negative
j1cnx9,"I mean, I thought the whole thing was real until that last tiger was up on its two legs. Then I was like, “hmm, wait a minute? These aren’t real tigers!”",5,28-09-2020 18:26,False,neutral,neutral,negative,neutral
j1cnx9,Since when tigers began to haunt in pack?,8,28-09-2020 17:52,False,neutral,neutral,neutral,neutral
j1cnx9,Kung Fu Panda stole the idea for Tigress from this.,4,28-09-2020 19:31,False,negative,negative,negative,negative
j1cnx9,"This was earlier , but for now things are much worse",4,29-09-2020 02:06,False,negative,negative,negative,negative
j1cnx9,This shit even beats the South Indian movies minus the VFX,4,29-09-2020 05:34,False,negative,negative,negative,negative
j1cnx9,Yeet the big cats. Problems solved.,7,28-09-2020 15:19,False,positive,neutral,positive,positive
j1cnx9,"Tiger lai sweet chin music didiraa, lmao.",7,28-09-2020 16:32,False,neutral,neutral,positive,neutral
j1cnx9,"To all the people who are making fun of CGI, those tigers where not meant to be tigers in the movie. They were the de facto Baddies with tiger customs donned on. 

Stop making fun about the scene to soothe/pet your ego/superior complexity without understanding the [context](https://youtu.be/y88Aq93zSOo?t=5773). [Further evidence](https://youtu.be/y88Aq93zSOo?t=5863).",6,29-09-2020 02:33,False,negative,negative,neutral,negative
j1cnx9,I cracked up so hard,2,28-09-2020 14:55,False,neutral,negative,negative,negative
j1cnx9,"No CGI or any effects, Just vibes",2,28-09-2020 16:55,False,neutral,neutral,positive,neutral
j1cnx9,Joe Exotic has nothing on this guy,2,29-09-2020 02:12,False,neutral,neutral,neutral,neutral
j1cnx9,"OP, This is next level. 💀

You should crosspost this to r/WTF. I am sure folks will get a kick out of it.",2,29-09-2020 05:58,False,neutral,negative,neutral,neutral
j1cnx9,Zindagi ma kahile pani movie clip herera yeti saro haseko thina aja hasna payiyo...,2,29-09-2020 11:30,False,neutral,neutral,neutral,neutral
j1cnx9,when is this movie from? how do i not know this? wow,1,28-09-2020 15:12,False,positive,positive,positive,positive
j1cnx9,u/Vredditdownloader,1,28-09-2020 15:23,False,neutral,neutral,neutral,neutral
j1cnx9,This shit real?,1,28-09-2020 16:08,False,negative,negative,negative,negative
j1cnx9,kun film ho yo..........sauce dimm na.............herna mann layo,1,28-09-2020 16:09,False,neutral,neutral,neutral,neutral
j1cnx9,Too dank.,1,28-09-2020 16:17,False,neutral,neutral,negative,neutral
j1cnx9,bruh,1,28-09-2020 16:22,False,neutral,neutral,neutral,neutral
j1cnx9,u/Vredditdownloader,1,28-09-2020 16:23,False,neutral,neutral,neutral,neutral
j1cnx9,She cute.,1,28-09-2020 16:32,False,positive,positive,positive,positive
j1cnx9,u/vredditdownloader,1,28-09-2020 16:40,False,neutral,neutral,neutral,neutral
j1cnx9,I got sold in the very last minute when the tiger starts going Mano a mano,1,28-09-2020 16:53,False,neutral,neutral,negative,neutral
j1cnx9,Lolll,1,28-09-2020 17:05,False,neutral,neutral,neutral,neutral
j1cnx9,u/vredditdownloader,1,28-09-2020 17:41,False,neutral,neutral,neutral,neutral
j1cnx9,Kaile ko film ho yo?,1,28-09-2020 18:25,False,neutral,neutral,neutral,neutral
j1cnx9,It wasn't even funny. I just felt sad.,1,28-09-2020 18:28,False,negative,negative,negative,negative
j1cnx9,u/vredditdownloader,1,28-09-2020 18:35,False,neutral,neutral,neutral,neutral
j1cnx9,u/Vredditdownloader,1,28-09-2020 20:00,False,neutral,neutral,neutral,neutral
j1cnx9,How old is this??,1,28-09-2020 20:01,False,neutral,neutral,neutral,neutral
j1cnx9,u/Vredditdownloader,1,28-09-2020 20:16,False,neutral,neutral,neutral,neutral
j1cnx9,This is fucking hilarious,1,28-09-2020 22:04,False,positive,positive,negative,positive
j1cnx9,u/vredditdownloader,1,28-09-2020 22:48,False,neutral,neutral,neutral,neutral
j1cnx9,[u/vredditdownloader](https://www.reddit.com/u/vredditdownloader/),1,28-09-2020 23:34,False,neutral,neutral,neutral,neutral
j1cnx9,LOL!,1,29-09-2020 00:22,False,positive,neutral,neutral,neutral
j1cnx9,u/vredditdownloader,1,29-09-2020 02:00,False,neutral,neutral,neutral,neutral
j1cnx9,let me give you my free award of the day 🤣🤣,1,29-09-2020 02:20,False,neutral,positive,neutral,neutral
j1cnx9,/u/vredditdownloader,1,29-09-2020 03:02,False,neutral,neutral,neutral,neutral
j1cnx9,Its the music for me.,1,29-09-2020 03:23,False,neutral,neutral,neutral,neutral
j1cnx9,Expect for the last part stunt it was pretty real 🤣🤣,1,29-09-2020 03:38,False,neutral,neutral,neutral,neutral
j1cnx9,And these tigers punch like homoons do..,1,29-09-2020 03:44,False,neutral,neutral,negative,neutral
j1cnx9,Haha.. this is great..  the old times,1,29-09-2020 04:01,False,positive,positive,positive,positive
j1cnx9,"Bruh this used to be one of my fav Nepali movie lol.   
Jangalaima Kharayo Jarayo still the best song.",1,29-09-2020 04:34,False,positive,positive,positive,positive
j1cnx9,u/VredditDownloader,1,29-09-2020 04:36,False,neutral,neutral,neutral,neutral
j1cnx9,Rip logic. Rip english.,1,29-09-2020 07:39,False,negative,neutral,negative,negative
j1cnx9,They are on an elephant,1,29-09-2020 10:03,False,neutral,neutral,neutral,neutral
j1cnx9,u/vredditdownloader,1,29-09-2020 12:33,False,neutral,neutral,neutral,neutral
j1cnx9,My Lord!,1,29-09-2020 13:46,False,neutral,neutral,neutral,neutral
j1cnx9,u/vredditdownloader,1,19-10-2020 01:44,False,neutral,neutral,neutral,neutral
j1cnx9,Warning: No idiots were harmed by making this movie,1,28-10-2020 14:26,False,negative,negative,negative,negative
j1cnx9,This is the reason we should support Nepali film industry,1,17-11-2020 16:50,False,positive,neutral,neutral,neutral
j1cnx9,No animals were physically harmed during the making of this film. Perhaps their pride was!,1,10-12-2020 20:09,False,negative,negative,negative,negative
j1cnx9,u/savevideo,1,23-12-2020 23:29,False,neutral,neutral,neutral,neutral
j1cnx9,Better quality then some low grade Netflix movies.,0,28-09-2020 14:35,False,negative,positive,positive,positive
j1cnx9,How the fuck do you expect people to take this seriously?,0,28-09-2020 18:58,False,negative,negative,negative,negative
j1cnx9,Whaat are you talking about? This is obviously ultra-realistic CGI.,42,28-09-2020 17:58,False,negative,neutral,positive,negative
j1cnx9,Christopher Nolan would be proud. /s,26,28-09-2020 18:27,False,neutral,positive,positive,positive
j1cnx9,"The list will be endless my friend. I used to watch about 25 35 Nepali movies in a year in cinemas. I had more good times than bad. Also positive aspect of watching Nepali movies is that you can watch it but you don't have to, you can miss the start and leave anytime you want. Oh and did I say anything about cheering, dancing, and throwing your jacket in the air while watching.",13,28-09-2020 22:56,False,neutral,neutral,neutral,neutral
j1cnx9,I like how the tigers are trying to punch him. Clearly next level !!!,36,28-09-2020 14:23,True,neutral,neutral,neutral,neutral
j1cnx9,Absolutely lol. Just saw this getting shared on Bollywood realism and wondered the same thing.,9,28-09-2020 18:05,True,neutral,neutral,neutral,neutral
j1cnx9,Nepali movies  are also called Kollywood??,4,29-09-2020 03:29,False,neutral,neutral,neutral,neutral
j1cnx9,i read that in David Atenborough's voice.,4,29-09-2020 06:20,False,neutral,neutral,neutral,neutral
j1cnx9,That's the bit that strikes you as unrealistic? lol,18,28-09-2020 19:13,False,negative,neutral,positive,negative
j1cnx9,they are alive not dead to haunt.,3,29-09-2020 06:21,False,neutral,neutral,negative,neutral
j1cnx9,"right after they learned hand to hand combat, lol.",1,02-10-2020 14:20,False,neutral,neutral,positive,neutral
j1cnx9,Ramesh Upreti ho Ramesh Upreti. Ajha usko patented trademark spinning roundhouse wheel kick dekhyo bhane usko drwanda ko kshyamata ma 0 prashachinha lagaaune bahek aru kehi garna sakidaina.,1,29-09-2020 10:55,False,neutral,neutral,positive,neutral
j1cnx9,That idea is terrible,3,29-09-2020 03:37,False,negative,negative,negative,negative
j1cnx9,You must be really fun at parties.,9,29-09-2020 03:24,False,positive,positive,positive,positive
j1cnx9,"This is 16 barse Joban. The actress Ishwori Pradhan used to be a child actress, the one in chhori malai bhagi bhagi nasatau, timilai babako maayaa kati lagchha re. And it was her first adult movie.",1,28-09-2020 22:59,False,neutral,neutral,negative,neutral
j1cnx9,"""16 barse joban """,2,28-09-2020 16:11,True,neutral,neutral,positive,neutral
j1cnx9,"###[View link](https://redditsave.com/info?url=/r/Nepal/comments/j1cnx9/credit_yeboi69/)


 --- 
 [**Info**](https://np.reddit.com/user/SaveVideo/comments/jv323v/info/)&#32;|&#32; [**Feedback**](https://np.reddit.com/message/compose/?to=Kryptonh&subject=Feedback for savevideo) &#32;|&#32; [**DMCA**](https://np.reddit.com/message/compose/?to=Kryptonh&subject=Content removal request for savevideo)&#32;|&#32;[**Donate**](https://ko-fi.com/getvideo)",1,23-12-2020 23:31,False,neutral,neutral,neutral,neutral
j1cnx9,What are y’all talking about? CGI? I thought this was National Geographic.,24,28-09-2020 23:52,False,neutral,neutral,negative,neutral
j1cnx9,Any movies with English captions (or English dub?),5,28-09-2020 15:57,False,neutral,neutral,neutral,neutral
j1cnx9,i watched it !! This jaya kisan guy has some character!!,1,29-09-2020 09:13,False,neutral,neutral,neutral,neutral
j1cnx9,Oscar worthy!,9,28-09-2020 14:49,False,neutral,positive,positive,positive
j1cnx9,Reminds me of *Hercules in New York* (Arnold Schwarzenegger's first movie) where he fights a bear and the bear is throwing uppercuts,4,29-09-2020 03:48,False,neutral,neutral,neutral,neutral
j1cnx9,"Kathmandu , so .",2,29-09-2020 09:59,False,neutral,neutral,neutral,neutral
j1cnx9,"Lol. Oh yes. If you aint sure, just ask Biplavs, and Makunes.",1,29-09-2020 04:03,False,neutral,neutral,neutral,neutral
j1cnx9,Adult movie? No no no,8,29-09-2020 02:13,False,neutral,neutral,neutral,neutral
j1cnx9,"https://gfycat.com/RawRequiredCaimanlizard

---

^(I am a bot.) [^(Report an issue)](https://www.reddit.com/message/compose/?to=pmdevita&subject=vredditshare%20Issue&message=Add a link to the gif or comment in your message%2C I%27m not always sure which request is being reported. Thanks for helping me out!)",1,28-09-2020 17:19,False,neutral,positive,neutral,neutral
j1cnx9,I only see a woman being attacked by tigers .,3,29-09-2020 15:01,False,negative,negative,negative,negative
j1cnx9,It wouldn't be the same movie after translation.,8,28-09-2020 17:43,False,neutral,neutral,positive,neutral
j1cnx9,Ooh! The Tamil film industry in south India is also called Kollywood!,3,29-09-2020 10:00,False,neutral,neutral,neutral,neutral
j1cnx9,"I meant it was her first movie in which she starred as an adult. [Enjoy](https://youtu.be/y88Aq93zSOo?t=5229) 


[Scene from the video title](https://youtu.be/y88Aq93zSOo?t=5773)",1,29-09-2020 02:26,False,neutral,neutral,neutral,neutral
j1cnx9,Cheese is smelly.,0,29-09-2020 10:54,False,negative,negative,negative,negative
j1cnx9,Tollywood is the Telugu fim industry,1,29-09-2020 10:55,False,neutral,neutral,neutral,neutral
