post_id,comment,upvotes,time,is_submitter,model1,model2,model3,majority_votes
jdsm92,CorUNO  cards.,71,19-10-2020 02:11,False,neutral,neutral,positive,neutral
jdsm92,"Saruwa rog ho corona

Yesle jaatbhat kei bhandaina

Na aau mero samu timi 

Mero janai lai yesle mandaina",25,19-10-2020 03:46,False,neutral,neutral,neutral,neutral
jdsm92,Haha. I am going to use this to keep my old school grandma inside the house now. Thank you.,9,19-10-2020 03:58,False,neutral,positive,positive,positive
jdsm92,Someone got the taste of his own medicine... lmao,17,19-10-2020 02:51,False,neutral,neutral,neutral,neutral
jdsm92,i dont know how many times I've seen this meme in this sub already,11,19-10-2020 03:09,False,neutral,neutral,negative,neutral
jdsm92,"I cringe everytime i ~~hear~~ read the word ""brahmin"".cause you never hear that on your every day lives. Its just ""bahun"". And writing brahmin just looks super pretentious

Edit: read ⬅️ hear",9,19-10-2020 04:15,False,negative,negative,negative,negative
jdsm92,male brahmin\*. even better,6,19-10-2020 02:02,False,positive,positive,positive,positive
jdsm92,Look how the table turned,6,19-10-2020 02:45,False,neutral,neutral,negative,neutral
jdsm92,Pass,2,19-10-2020 03:24,False,neutral,neutral,neutral,neutral
jdsm92,What if daughter is on her periods and grandfather gets covid. Who gets the shed?,2,19-10-2020 14:43,False,neutral,negative,negative,negative
jdsm92,"Finally I will get to say ""Mummy ma naxune vaye"" instead of my sister!",2,01-11-2020 14:37,False,neutral,neutral,neutral,neutral
jdsm92,"*A woman in her periods gets Covid-19*

Brahmins = GET IN THE GOAT SHED!!!",4,19-10-2020 03:49,False,negative,negative,neutral,negative
jdsm92,This needs more upvotes.,2,19-10-2020 02:50,False,neutral,neutral,neutral,neutral
jdsm92,I swear Tom and jerry have the best memes.,1,19-10-2020 03:24,False,positive,positive,negative,positive
jdsm92,Wait.... that's illegal,0,19-10-2020 03:44,False,neutral,neutral,neutral,neutral
jdsm92,"What the fuck , making all memes on castes, You will never change you fucking bastard.",0,19-10-2020 13:46,False,negative,negative,negative,negative
jdsm92,Listen here you little shit,-4,19-10-2020 05:16,False,negative,negative,negative,negative
jdsm92,BIG PP,0,19-10-2020 05:24,False,neutral,neutral,neutral,neutral
jdsm92,Make my day men! 🤣😂,-8,19-10-2020 03:17,False,neutral,neutral,positive,neutral
jdsm92,The Covidables jeez.,1,19-10-2020 03:30,False,negative,neutral,neutral,neutral
jdsm92,*You've been bamboozled!*,1,19-10-2020 04:49,False,neutral,negative,neutral,neutral
jdsm92,And you become Dalit !!,1,02-11-2020 14:26,False,neutral,neutral,negative,neutral
jdsm92,Karma reverse.,1,05-03-2021 08:20,False,neutral,neutral,negative,neutral
jdsm92,"considering the word comes like one aday in this sub and you of all people have to deal with this sub, i am surprised",2,19-10-2020 10:11,False,neutral,neutral,positive,neutral
jdsm92,caste discrimination bhayo ni ta pheri,1,19-10-2020 08:32,False,neutral,negative,negative,negative
jdsm92,Fuck no,-1,19-10-2020 09:08,False,negative,negative,negative,negative
jdsm92,That's not gonna happy anytime sooner. Maybe in the next 50 years or so.,1,19-10-2020 11:28,False,positive,positive,positive,positive
jdsm92,Why though?,1,19-10-2020 03:52,False,neutral,neutral,positive,neutral
jdsm92,Lamestest humour attempt.,16,19-10-2020 02:48,False,negative,negative,negative,negative
jdsm92,"Bruh, get a sense of humor man.",4,19-10-2020 03:24,False,negative,neutral,positive,negative
jdsm92,"I believe, everyone does that.",-1,19-10-2020 02:50,False,neutral,neutral,positive,neutral
jdsm92,"Haha i meant reading it is wierd cause no one says that out loud irl. But it's used in almost every time in here instaed of the word bahun. I edited the above comment from ""hear"" to ""read'",1,19-10-2020 10:32,False,neutral,neutral,neutral,neutral
jdsm92,\*if they are more qualified than others,1,19-10-2020 11:26,False,neutral,neutral,neutral,neutral
jdsm92,"As a brahmin, I second you. Sometimes, people just need to shut up a laugh a bit together. No need to be serious all the time.",9,19-10-2020 03:23,False,negative,neutral,neutral,neutral
jdsm92,pheri Brahmin haru lai discriminate garya jasto hunxa ni ta tei bhaera . For eg: mbbs ma dalit kota xa jasma k hunxa bhani abba euta Brahmin xa usko dalit bhanda dherai marks ayo exam ma tara pani tyo Brahmin mbbs scholarship ma padhna paudeina jaha bhane Dalit le tya kota ma thorai marks lyaye pani u mbbs padhna paunxa,4,19-10-2020 11:35,False,neutral,neutral,negative,neutral
jdsm92,quota decrease garni bhanya haina sabbai lai equal chance dini bhaneko ho,1,19-10-2020 13:35,False,neutral,neutral,negative,neutral
jdsm92,ho bro ho dinu parxa dinu parxa tara dukhi gareeb lai dinu parxa caste ko bhar ma dinu hudeina .,3,19-10-2020 14:03,False,neutral,neutral,neutral,neutral
