post_id,comment,upvotes,time,is_submitter,model1,model2,model3,majority_votes
klojao,What did you use to draw this? Hardware/Softwares?,5,28-12-2020 13:17,False,neutral,neutral,neutral,neutral
klojao,Nagbahal ko?,4,28-12-2020 13:34,False,neutral,neutral,negative,neutral
klojao,naisuu good to see a fellow nepali artist,5,28-12-2020 13:46,False,positive,positive,positive,positive
klojao,Love the details....this seems to tell a story too,3,28-12-2020 14:43,False,positive,neutral,positive,positive
klojao,patan area ko gharharu... tara height nai sano hune vitra gharma ani galli tira jada ni nihurera hidnu parne.. tara j vaye ni ramailo hunxa😂,3,29-12-2020 23:52,False,neutral,neutral,neutral,neutral
klojao,This looks really nice.,2,28-12-2020 15:56,False,positive,positive,positive,positive
klojao,my mamaghar used to look like this years ago. for a moment i thought you'd drawn it.,2,28-12-2020 16:08,False,neutral,neutral,negative,neutral
klojao,"Bhaktapur ko yad aayo.

Khattra hai ta solti",2,28-12-2020 16:57,False,neutral,neutral,positive,neutral
klojao,Nice! Love to see it!,2,28-12-2020 16:57,False,positive,positive,positive,positive
klojao,Nice 👍👍,2,28-12-2020 17:21,False,positive,positive,positive,positive
klojao,This is such a detailed art. Kudos to your hardwork. It looks really amazing .,2,29-12-2020 03:04,False,positive,positive,positive,positive
klojao,This is awesome.,2,29-12-2020 03:43,False,positive,positive,positive,positive
klojao,Khata cha,2,29-12-2020 15:25,False,neutral,neutral,positive,neutral
klojao,really great work. i liked those other houses on the side complimenting the old house.,2,31-12-2020 05:47,False,positive,positive,positive,positive
klojao,"pretty cool, very nice.",1,28-12-2020 13:45,False,positive,positive,positive,positive
klojao,Reminds me of a location in pokhara,1,28-12-2020 14:03,False,neutral,neutral,negative,neutral
klojao,Awesome work man like the one of basantapur area. Would be perfect for a comics based on KTM city story. You have a distinct style .,1,29-12-2020 01:30,False,positive,positive,positive,positive
klojao,"I used a picture as a reference but I wasn't going for a photorealistic look, just a sketch and colors on top. Thank you for your compliment.",7,28-12-2020 12:16,True,positive,positive,positive,positive
klojao,"Software: clipstudio paint, hardware: drawing tablet",7,28-12-2020 13:30,True,neutral,neutral,neutral,neutral
klojao,Yes,2,28-12-2020 13:42,True,positive,neutral,neutral,neutral
klojao,"I used to live in a house like this. I used to get scolded for jumping and playing on the top floor because they could tell by all the dust falling on the lower floors. The wooden stairs used to creak and you could tell if someone was coming up. It's all nostalgia now as it has been replaced by a sunlight-blocking cement Lego building.

So in short, yes I kinda drew your mamaghar, my ghar and all the old ghars that we fondly remember.",6,28-12-2020 17:47,True,neutral,neutral,negative,neutral
klojao,Thank you!,1,28-12-2020 13:50,True,positive,neutral,positive,positive
klojao,It's patan.,2,28-12-2020 14:08,True,neutral,neutral,neutral,neutral
klojao,Thank you!,1,29-12-2020 01:50,True,positive,neutral,positive,positive
klojao,"Are you in Nepal? I looked into some good drawing tablets, but couldn't find a good one for reasonable price here. YouTube says they're no good without pressure sensitivity. I'm a total amateur, so I maybe wrong, but I didn't see any gradual color transition here in this piece. Are you using one without pressure sensitivity?",4,28-12-2020 14:47,False,positive,positive,positive,positive
klojao,Ramro cha :),3,28-12-2020 13:54,False,neutral,neutral,positive,neutral
klojao,"I am in the US. Yes pressure sensitivity and tilt response is needed to make it worthwhile vs pen and paper. Here you can get a basic pen pressure tablet for around $39 to $50 here. If you are starting off, you don't need pressure sensitivity, work on your lines and play with free software like krita. 

Invest in a tablet when you think you will enjoy making stuff.",5,28-12-2020 22:07,True,neutral,positive,positive,positive
klojao,Thanks,2,28-12-2020 13:54,True,positive,neutral,positive,positive
klojao,Could you please help out with link/s to the drawing tablet you would recommend for someone who wants to check out digital art? You could DM if it’s not “allowed” to post a link,1,29-12-2020 09:19,False,positive,neutral,positive,positive
klojao,"I would search on Amazon, brands like XP-PEN, Huion and Wacom. Get the 10 inch ones that have no screen, should run $49-$79. There is a learning curve as you draw by looking at the screen and not where your pen is. If you rather get a screen tablet, get Huion Kamvas 13 which is around $200. 

Finally there is always iPad and Samsung S series tablets. For iPad you need to buy the pen separately and Procreate is a very good app, for Samsung Tab S series you don't need to buy a pen. Even older tablets like Samsung Tab S3 is really good for drawing. Also look at Facebook marketplace or eBay for second-hand ones.

All this is true if you are in the NA or Europe. Try Daraz if you are in Nepal. Hope I helped and good luck.",3,29-12-2020 11:07,True,neutral,positive,neutral,neutral
klojao,"Thanks, this helps. And continue on your journey, this is a really good sketch!",1,29-12-2020 16:42,False,positive,positive,positive,positive
klojao,You're very welcome.,1,29-12-2020 16:46,True,positive,positive,positive,positive
