post_id,comment,upvotes,time,is_submitter,model1,model2,model3,majority_votes
l0i1hf,This is well made I think mods will respond to this,65,19-01-2021 11:36,False,neutral,neutral,positive,neutral
l0i1hf,Anuhar ni momo jastai cha. +1,51,19-01-2021 12:00,False,neutral,neutral,positive,neutral
l0i1hf,I'm not Nepalese but the comments seemed positive so I've upvoted.,35,19-01-2021 12:21,False,positive,positive,neutral,positive
l0i1hf,nice,13,19-01-2021 11:48,False,positive,positive,positive,positive
l0i1hf,"Can anyone explain to me what karma is,what upvote/downvote is,& what award does?",5,19-01-2021 17:55,False,neutral,neutral,neutral,neutral
l0i1hf,"This might be unpopular opinion, but this logo does a biased representation of Nepal.",24,19-01-2021 12:57,False,negative,negative,negative,negative
l0i1hf,"I'd say add in a small nepal flag logo on their chest, since that'd be common representative of all.",7,19-01-2021 15:24,False,neutral,neutral,positive,neutral
l0i1hf,"This looks totally fine but where are   



  Tharu (6.6%)

  Tamang (5.8%)

  Newar (5%)
  
   Magar (7.1%)

  Kami (4.8%)

  Nepalese Muslims (4.4%)

  Yadav (4%)

  Rai (2.3%) and 

  Others (31.2%)?









wiki copy pasta",4,20-01-2021 06:13,False,neutral,positive,positive,positive
l0i1hf,AMAZING.,3,19-01-2021 17:48,False,positive,positive,positive,positive
l0i1hf,Khas supremacists,3,21-01-2021 11:06,False,negative,neutral,negative,negative
l0i1hf,This is good but a bit too good to be logo of r/Nepal,6,19-01-2021 13:57,False,positive,positive,positive,positive
l0i1hf,As much as i like the logo it doesn't represent the whole Nepal. Nice effort though.,6,19-01-2021 14:31,False,positive,positive,positive,positive
l0i1hf,Hope this doesn't die in new,7,19-01-2021 11:44,False,neutral,neutral,positive,neutral
l0i1hf,Noice,2,19-01-2021 17:14,False,neutral,negative,negative,negative
l0i1hf,Love it!,2,19-01-2021 17:53,False,positive,positive,positive,positive
l0i1hf,Ramro raicha good try congratulations,2,20-01-2021 05:03,False,positive,positive,positive,positive
l0i1hf,cute!,2,20-01-2021 09:24,False,positive,positive,positive,positive
l0i1hf,"I fully support this and for people saying oh it represents just one culture, come on.. we have over 120 ethnic groups, how can you combine them in one avatar??. this is a part of Nepali culture.. Don't be so politically correct or woke",2,21-01-2021 04:24,False,neutral,neutral,positive,neutral
l0i1hf,Cool,2,21-01-2021 12:37,False,positive,positive,positive,positive
l0i1hf,I love it. Can someone create the other half of the boy. That would be awesome. :),2,24-01-2021 12:51,False,positive,positive,positive,positive
l0i1hf,better suited for r/Khas,6,19-01-2021 16:18,False,neutral,positive,positive,positive
l0i1hf,"Nice. but were we looking for new logo, I didn't know.",3,19-01-2021 12:13,False,positive,positive,positive,positive
l0i1hf,"Assuming our Nepali society wholeheartedly cherish secularity and religious and social tolerance, emblemizing r/Nepal with this logo not only erupts biasness feeling in the newcomers and existing fellow redditors but also misinforms incoming foreign lurkers about our great cultural diversity and respective traditional attires. r/Nepal is a home to every ethnic groups residing in our homeland and mustn't underrepresent the rest by implementing the proposed logo as r/Nepal sub icon that just signifies a single ethnic group out of 100 leaving the rest out the window. 

Wished my intuition didn't hurt the sentiments of fellow redditors.",3,19-01-2021 18:49,False,neutral,neutral,negative,neutral
l0i1hf,Nice,2,19-01-2021 12:04,False,positive,positive,positive,positive
l0i1hf,yep this is it.,2,19-01-2021 12:52,False,neutral,neutral,neutral,neutral
l0i1hf,This is amazing dawg,2,19-01-2021 13:53,False,positive,positive,positive,positive
l0i1hf,"Its great, i have been learning graphics designing and I love coming across these awesome things.",2,19-01-2021 13:56,False,positive,positive,positive,positive
l0i1hf,Vouchh,2,19-01-2021 14:23,False,neutral,neutral,neutral,neutral
l0i1hf,I think this is perfect.,2,19-01-2021 14:39,False,positive,positive,positive,positive
l0i1hf,Well done !!,2,19-01-2021 14:43,False,positive,positive,positive,positive
l0i1hf,"Its a great illustration. Congrats.
But it doesnt reflect the new nepali youth, i am afraid. Do we have to prove our nepaliness with traditional clothing all the time. Why cant we have a more realiatic image of todays nepali youth wearing baseball hats, tank tops or piercing and with tattoes and glasses? And in one of those you can insert something that screams nepali? A tshirt with buddha or a baseball hat with our flag or nepal written somewhere?",2,20-01-2021 03:40,False,neutral,positive,positive,positive
l0i1hf,nepali vanda newari layo malai ta.,1,19-01-2021 18:25,False,neutral,neutral,negative,neutral
l0i1hf,Is this supposed to be Mahadev Parvati or something?  I like it though.,1,19-01-2021 15:42,False,neutral,neutral,neutral,neutral
l0i1hf,"I fixed the logo. I feel this one is more appropriate 

https://imgur.com/a/pxR3ByC",-3,19-01-2021 20:34,False,neutral,neutral,positive,neutral
l0i1hf,"Would be a good logo for r/pahad . For r/Nepal , not so much.

Nice artwork though.",-7,19-01-2021 12:37,False,positive,positive,positive,positive
l0i1hf,Background ma Sagarmatha ani Buddha was Born in Nepal logo ni huna paryo. (Pun Intended),0,19-01-2021 15:48,False,neutral,neutral,neutral,neutral
l0i1hf,"face alikati lamcho banaunu paryo and kti ko forehead ma rato tika but half, semicircle ani tei match garnalai ktako ma half kalo tika lagaide jhanai ramro hunthyo :)",-3,19-01-2021 12:17,False,neutral,neutral,negative,neutral
l0i1hf,"u/Usernp

u/Narcius",-2,19-01-2021 12:36,False,neutral,neutral,neutral,neutral
l0i1hf,its a good one,1,05-02-2021 14:56,False,positive,positive,positive,positive
l0i1hf,Perfecto!,1,13-02-2021 14:15,False,positive,positive,positive,positive
l0i1hf,The morrow of Happy Maha Shivaratri,1,12-03-2021 22:14,False,positive,positive,positive,positive
l0i1hf,Thats pretty awesome,1,23-05-2021 22:54,False,positive,positive,positive,positive
l0i1hf,"u/ordinaryeeguy had created the post, maybe OP has to post the reply in the comments",6,19-01-2021 15:29,False,neutral,neutral,neutral,neutral
l0i1hf,So....uhh how did you end up here?,3,19-01-2021 15:01,False,neutral,neutral,neutral,neutral
l0i1hf,😜 you are cute,1,19-01-2021 17:10,False,positive,positive,positive,positive
l0i1hf,"**So nice, awww! this is.** 

 *-Pyroqua*",20,19-01-2021 11:51,False,positive,positive,positive,positive
l0i1hf,Some subs have specific karma requirements to participate there. Certain awards give you ad free Reddit for some time. It basically does nothing.,1,20-01-2021 03:33,False,neutral,neutral,negative,neutral
l0i1hf,no its popular. even i was thinking the same but didnt comment,12,19-01-2021 13:58,False,neutral,neutral,positive,neutral
l0i1hf,I agree. Female dress should be sari maybe instead,3,20-01-2021 11:46,False,neutral,neutral,positive,neutral
l0i1hf,"only bahun chetteri represents nepali, other r there to fill form",2,21-01-2021 13:27,False,neutral,neutral,positive,neutral
l0i1hf,"Yeah that is true. Maybe instead a sari should be worn for the female side, as a lot of women in Nepal wear them. For males, keep the topi, but replace daura with kurta, as that's Hindu dress",1,20-01-2021 11:47,False,neutral,neutral,neutral,neutral
l0i1hf,"There are 67 ethnic groups.. Haven't you studied social studies? And this logo doesn't even represent many high percentage population cultures.. like Tamangs.. Rais.. Maithali.. Magar.. Gurung.. etc etc

Also this logo will be good for subreddits like r/Khas or something.. but if we put this as a logo of r/Nepal then it'll create division among ourselves.. And this is against our own country.. i.e. gardens of all types of people..

Edit: sorry it's not 67.. but 123 ethnic groups.. my bad for not researching properly..",-6,19-01-2021 18:20,False,neutral,negative,negative,negative
l0i1hf,Agreed!,2,19-01-2021 15:41,False,neutral,positive,positive,positive
l0i1hf,hoina  Golden retriever hola,3,21-01-2021 13:28,False,neutral,neutral,positive,neutral
l0i1hf,"While I personally prefer to stay grounded centrist in my beliefs, it felt important to have a word with you, specifically evoked with your scoffing attitude towards some handfuls who went off on a tangent to express how unjust the logo is for r/Nepal, a sub meant to flat out represent Nepali art. I'm guessing you're taking pride for having your cultural attire emblemized seeing how strongly you're advocating it; okay, no problem whatsoever but I disgress. Obviously there's nothing wrong with having different beliefs but that ridiculing tone won't be exactly productive for a civil discussion. Just because you pose an impractical solution of squeezing every bit of Nepali cultural identities in a 90X90 pixels size as a means of cultural representation won't do justice. You know this and so does everyone. How about coming up with sth that has been the hallmark of Nepal in everyone's eyes rather than leaning on some cultural aspect that plainly becomes an apple of discord among everyone out there. As much as you'd love to represent your individual distinct culture to the world, there are, as you stated, over 120 ethnic groups claiming their pounds of flesh. So, bear that in mind.",1,21-01-2021 17:27,False,neutral,neutral,negative,neutral
l0i1hf,Except daura suruwal was the traditional dress of the natives of Kathmandu valley(newars) before khas invasion and cultural appropriation of it. It's relatable to most of the hill people but not to those of us from the mountains and Terai.,4,20-01-2021 03:29,False,neutral,negative,neutral,neutral
l0i1hf,"Totally! Why don't we try to live like a country for every kind of people..? We're very very diversed with 67 ethnic groups.. all have different languages, culture, food, etc etc.. even China doesn't have this much diversed people.. I don't reside in Nepal.. my family lives in Nepal.. but I know this is against ourselves..

Edit: There are 123 ethnic groups.. not 67.. sorry for not researching before commenting..",2,20-01-2021 02:14,False,neutral,neutral,negative,neutral
l0i1hf,why does it say that i cant view pahad subreddit? i am new to this reddit thingy please enlighten me :),4,19-01-2021 14:19,False,negative,neutral,negative,negative
l0i1hf,"Smh noob... what about Ram, Sita, Jesus and the flying spaghetti monster? /s",5,19-01-2021 16:51,False,negative,negative,neutral,negative
l0i1hf,u/xbhaktapur,4,19-01-2021 12:37,False,neutral,neutral,neutral,neutral
l0i1hf, What would we bee doing  without ur genius,27,19-01-2021 14:17,False,positive,positive,negative,positive
l0i1hf,Our one is called sanoo\~,16,19-01-2021 14:58,False,neutral,neutral,neutral,neutral
l0i1hf,Nipple,28,19-01-2021 15:33,False,neutral,neutral,positive,neutral
l0i1hf,I sorted by top in the last hour and scrolled far enough that this came up.,9,19-01-2021 20:21,False,neutral,neutral,neutral,neutral
l0i1hf,Thanks. :),0,19-01-2021 20:53,False,positive,neutral,positive,positive
l0i1hf,bot spotted,1,19-01-2021 15:34,False,neutral,neutral,negative,neutral
l0i1hf,Good bot,1,19-01-2021 15:36,False,positive,positive,positive,positive
l0i1hf,So how do I earn karma?,3,20-01-2021 03:36,False,neutral,neutral,negative,neutral
l0i1hf,Don't be afraid of the downvotes. Karma doesn't matter,0,19-01-2021 16:03,False,negative,negative,negative,negative
l0i1hf,only represents clothing from one culture I guess?,9,19-01-2021 13:46,False,neutral,neutral,positive,neutral
l0i1hf,well.. again i disagree with you and it is just a logo and to insert politics into it or inclusion nonsense is ridiculous alright..,2,22-01-2021 02:34,False,negative,negative,negative,negative
l0i1hf,That's because it doesn't exist.,1,19-01-2021 16:11,False,neutral,neutral,positive,neutral
l0i1hf,u/xxxbhaktapur,3,19-01-2021 12:50,False,neutral,neutral,neutral,neutral
l0i1hf,"So you've literally hit rock bottom huh XD.

We'll be waiting for you above",8,20-01-2021 02:28,False,negative,negative,negative,negative
l0i1hf,"You are funny.

 *-Pyroqua*",5,19-01-2021 12:03,False,neutral,neutral,positive,neutral
l0i1hf,"[Pleased, Yoda is.](https://i.imgflip.com/3ptsd8.png)",3,19-01-2021 15:36,False,positive,neutral,positive,positive
l0i1hf,"Thank you, nocturnal_1_1995, for voting on YodaOnReddit-Bot.

This bot wants to find the best and worst bots on Reddit. [You can view results here](https://botrank.pastimes.eu/).

***

^(Even if I don't reply to your comment, I'm still listening for votes. Check the webpage to see if your vote registered!)",1,19-01-2021 15:36,False,negative,neutral,negative,negative
l0i1hf,"Karm Karo Parth, karma ki apekshya math Karo. Tumhaare karm par tumhara adhikaar hai lekin Uske karma par Nahi.",7,20-01-2021 04:16,False,neutral,neutral,negative,neutral
l0i1hf,i wasnt afriad of down votes but too bored to comment,6,19-01-2021 16:07,False,neutral,negative,negative,negative
l0i1hf,"""Karma gara karma ko asha nagara"" - some woke Nepali redditor probably.",6,19-01-2021 16:49,False,negative,neutral,neutral,neutral
l0i1hf,Yeah.. There are 123 ethnic groups in Nepal with their own language culture and history.. but this logo represents the culture of only one ethnic group.. so putting this as a logo of r/Nepal will increase our division in the society.. These things should be avoided..,12,19-01-2021 18:18,False,neutral,neutral,negative,neutral
l0i1hf,"You wouldn't base it off of dress, language, ethnicity. Create it based on something common like national flag, national map, national animal or any other national identity.",3,20-01-2021 03:31,False,neutral,neutral,neutral,neutral
l0i1hf,"It's not about creating a logo for 67 different groups.. it's about avoiding anything that'll create a division in ourselves..

Tell me do you think Just representing one ethnic group for a subreddit called Nepal is good?

We're a diversed country.. so try to live like a family in this diversed country.. that's what our national anthem says too.. If you think only one ethnic group deserves to be the logo of freakin r/Nepal then what'll be the impression of all the other ethnic groups?",2,20-01-2021 02:01,False,neutral,neutral,positive,neutral
l0i1hf,"Phew... needless to say it seems like you barely got the gist of the entire justification and for the love of god, where in the goddamn excerpt, you got the asserted picture of politics. No wonder how much figuratively rightfulness will be painted before you, your contemptuous reply proves how much of a self-righteous and inconsiderate you really are.",1,22-01-2021 14:32,False,negative,negative,negative,negative
l0i1hf,oh shit i get it now😅 i am sorry,3,19-01-2021 16:13,False,negative,negative,negative,negative
l0i1hf,u/xkathmandu,1,19-01-2021 12:54,False,neutral,neutral,neutral,neutral
l0i1hf,Hah. It wasn't that far down.,3,20-01-2021 04:38,False,positive,neutral,neutral,neutral
l0i1hf,"**Funny. *-pyroqua*, you are.** 

 *-Aseem747-8*",10,19-01-2021 12:04,False,neutral,neutral,positive,neutral
l0i1hf,Why did I read this in Krishna's voice?,3,20-01-2021 05:10,False,neutral,neutral,neutral,neutral
l0i1hf,Karm ki apekshya mat karo lekin yeh toh batao ki karm kaise prapta kare,1,20-01-2021 06:33,False,neutral,neutral,negative,neutral
l0i1hf,">67 ethnic groups

Wasn't it ~126 or did I learn it wrong?",3,20-01-2021 08:31,False,negative,negative,negative,negative
l0i1hf,"Yeah, a logo based on steak would be amazing /s",1,20-01-2021 06:02,False,positive,positive,positive,positive
l0i1hf,"Old man's dead.

I am the new thing now.",2,19-01-2021 13:13,False,negative,negative,negative,negative
l0i1hf,"[Sad, Yoda is.](https://i.kym-cdn.com/photos/images/newsfeed/001/648/347/bea.png)",1,19-01-2021 15:39,False,negative,negative,negative,negative
l0i1hf,"Karma ki apekshya mat Karo. Karm karo. 

Your karm on Reddit is to speak your mind, engage in thoughtful discussion, post good content and don't expect karma for your karm.",1,20-01-2021 07:07,False,neutral,neutral,positive,neutral
l0i1hf,"Oh my bad! Thanks for mentioning.. I have edited my comment and yes according to the ministry of foreign affairs website.. there are 123 ethnic groups/casts.. 

For comparison China has only 56 ethnic groups..",1,20-01-2021 13:58,False,neutral,negative,negative,negative
l0i1hf,"The current logo is biased too. There, done.",2,20-01-2021 04:58,False,neutral,neutral,negative,neutral
l0i1hf,"Oh, he is very much alive.

Married. So, I guess he's on his way to death.",2,19-01-2021 13:14,False,neutral,neutral,negative,neutral
l0i1hf,yoda is going to have a stroke,3,19-01-2021 15:27,False,neutral,neutral,neutral,neutral
l0i1hf,"Suddo got married? 

That is something I wasn't prepared for.",2,19-01-2021 14:00,False,neutral,neutral,positive,neutral
