post_id,comment,upvotes,time,is_submitter,model1,model2,model3,majority_votes
v40dqv,Imagine joinig science because you think you're good at studying!,18,04-06-2022 00:07,False,neutral,positive,neutral,neutral
v40dqv,Bro see this eleven class people. They had their whole class 10 online and gave all exams online. They got free 4.00 and A+ in exam. Aaile ko class 12 le ta 10 physically padeko thiyo. Aaile ko 11 haru 12 ko board chai it will be seriously fucked up.,52,03-06-2022 14:50,False,negative,negative,negative,negative
v40dqv,"To be fair aaile ko 12 ko batch le 10 class purai padhekai ho. Exam ko ek din aagadi cancel bhako ho so we can assume they were prepared for it. Aaile 11 ma padhe batch cahi spoiled ho 10 padhnai na pari A+ pako xa. 

&#x200B;

PS: ma ni aaile 11 mai ho so i can vouch lol",14,03-06-2022 16:27,False,neutral,neutral,negative,neutral
v40dqv,"tbh questions aren't that tough at all

basic concepts were tested but most students ran after questions that most teachers labelled 'important' or were frequently asked in previous years. the ones crying now are the students who skipped most of the theory. The books were old, teaching methodology was old, plus no study leave for maths exams. next batches are going to find maths easier. most questions will not carry more than 4 marks, proving type questions are barely asked. weak students who were expecting to pull out marks from Rolle's theorem, first principle derivative... were the ones who suffered as these questions werent asked at all, or were asked in theoretical form (basic)",8,04-06-2022 03:37,False,negative,neutral,negative,negative
v40dqv,"Indian hoon aur ye meme dikh Gaya, ekdam accurate hai hamare lie bhi",3,04-06-2022 06:40,False,neutral,neutral,positive,neutral
v40dqv,Idk malai ta jamma B+ Deko thyo,3,03-06-2022 16:02,False,neutral,neutral,neutral,neutral
v40dqv,Question kasto ako raicha herau bhaneko kasaile pani haldainan ta khai. +2 exam deko bhai baini haru question herauna pathau ta.,3,03-06-2022 18:50,False,neutral,neutral,neutral,neutral
v40dqv,plot twist: None of the exams are real,3,04-06-2022 14:22,False,neutral,neutral,negative,neutral
v40dqv,"Kasto bujna nasakeko ho peanut brain.
SEE ma full classes liyera totally prepared vako thiyo. Aaile ta online classes bata padeko. Aaja starting 2-3 weeks ta syllabus ra course nai set vako thiyena. Teachers haru le aafai guess garera padairako thiyo. Course set vaye paxi time ekdam limited thiyo so course sidauney gari padayo bujey pani nabujey course sidauna matra thiyo target. Question model ni sure thiyena. Kasto question kati marks ma expect garni no idea so aaile garo ta vaihalxa ni.",7,04-06-2022 02:47,False,neutral,,positive,neutral
v40dqv,I used to get 3.95 or 3.90 in  pre SEE so I was confident at getting A+ .In class 11 I started slacking off and now I am not sure what garde  I will get . Bro I think it is same for many students out there .,4,03-06-2022 16:34,False,neutral,neutral,neutral,neutral
v40dqv,Muji question ta sajilo thyo physics tara choke khaiyo dherai thau ma,2,03-06-2022 21:16,False,neutral,neutral,negative,neutral
v40dqv,Next year express.,2,04-06-2022 03:03,False,neutral,neutral,neutral,neutral
v40dqv,Genz's are really weird,3,03-06-2022 17:46,False,negative,negative,negative,negative
v40dqv,Madarjat 10 ma hamle Bihana 6 baje dekhi Bella 8 baje samma school padeko ho. Exam bhayeni a+ authyo. Kei thaxaina bhane na karao bro.,-20,03-06-2022 14:58,False,neutral,neutral,negative,neutral
v40dqv,Wtf 2 years Vai sakyo🙂,1,03-06-2022 20:55,False,negative,negative,negative,negative
v40dqv,Meme post halnu bhanda padhnw jau sathi.,1,04-06-2022 01:50,False,neutral,neutral,positive,neutral
v40dqv,Kina yeti Triggered bro yr Gunaso rakhda yo post garis tyo post garis vnxa bujhnai garo😂,1,04-06-2022 07:16,False,negative,neutral,negative,negative
v40dqv,Corona SLC/ SEE batch will be a different specie in the history of Nepali education.,1,27-06-2022 04:45,False,neutral,neutral,neutral,neutral
v40dqv,aba aafno 10 balla balla pas gareka uncle haru ley  yo vanney nei vaye sorry sorry ini haru ley t samudra par garera jungle naghera sagarmatha chadera school janthe ni aba tyo corona ko batch ko bela exam cancel gariyo vaney hamro k galti xa r aba diyiyo A+ aba k garam vanam tapaile nei vannu andolan garney ? maoist kal feri suru garney aba sabai t testo thiyenan ni hami dherai jaso teti prepared thim ki physical exam ma ni A+ nei aauthew kit 4 ni aauthew tara aba exam vayena t vayena tei chiz lai kotai kotai k pauxau most probably josle yo meme haleko tesko xoro lai A+ diyena vanera ho ?? ki aafu lai nei C+ diyiyo vanera ani aru ko grade dekhera aafnei aago ma jali marna lako? kta kti jasto kura garxan yarr budhi navaka,1,12-07-2022 18:06,False,neutral,,negative,neutral
v40dqv,agree group ma plus two ka dherai raichan ani tei jamat hamlai bhai bhanirachan,39,03-06-2022 17:50,False,neutral,neutral,positive,neutral
v40dqv,"Ma ta derai ko uncle, mama raichau. Yo group ma +2 dine ko ta",3,04-06-2022 01:58,False,neutral,neutral,neutral,neutral
v40dqv,new trend,4,03-06-2022 15:49,False,neutral,neutral,neutral,neutral
v40dqv,9 class ko fucche haru ni chan hau 🤦,1,04-06-2022 05:49,False,neutral,negative,neutral,neutral
v40dqv,"yup, and i did that mistake some time ago.",3,04-06-2022 07:25,False,neutral,negative,negative,negative
v40dqv,remindme! 365days,33,03-06-2022 14:59,False,neutral,neutral,positive,neutral
v40dqv,"This current batch had 11th pretty much entirely online and the new curriculum was implemented with only 4/5 months left till class 11 ended. We might as well not even have studied that year. Even class 12 this year was a mess considering how damn late we even got our books.

Current grade 11 is way better off even though they will be having problems next year. They'll have prep material available wayy earlier as well.",14,03-06-2022 18:22,False,positive,neutral,neutral,neutral
v40dqv,Ani aaile ko 12 ley pani ta 11 online ta padya hota🤷‍♂️,3,03-06-2022 17:52,False,neutral,neutral,negative,neutral
v40dqv,remindme! 365days,1,03-06-2022 17:44,False,neutral,neutral,positive,neutral
v40dqv,"Class 11 is just Class 12 part 1. So, 11 is very important, I guess.",1,04-06-2022 09:22,False,neutral,neutral,neutral,neutral
v40dqv,"Still an entire year left to catch up for 12th. Your schedule, availability of books, and prep material will be available from the very start. Next batch will be better prepared than this one at the very least.

Current batch did about a third of the academic year online in 12th, got books months after classes commenced and didn't even have a model question and specification grid to prep with till a couple of months ago. Class 11 was even bigger of a joke for our batch than 10 was for yours. Almost entirely online, new curriculum finally implemented in the middle  of the year, internal online exams for finals, incomplete course and inflated grades. Less overall time spent studying +2 as well. Only slightly over 1.5 years since the start of 11th.

Very few have managed to keep it together the last 2 years in regards to consistent focus for their studies. Everyone who didn't (especially in the science) are struggling.",7,03-06-2022 18:39,False,neutral,neutral,neutral,neutral
v40dqv,"So true. 
We studied what teachers labelled important and the question bank but the question was wildly different from what I had seen !!",1,08-06-2022 14:40,False,neutral,neutral,positive,neutral
v40dqv,Millennials haru aba Indian dekhepaxi backoff lekhne hola ni haina ta?,3,04-06-2022 06:46,False,neutral,neutral,positive,neutral
v40dqv,You must be C grader!,7,04-06-2022 00:49,False,neutral,neutral,positive,neutral
v40dqv,"My school pretty much gave numbers similar to what was expected in the actually exam. 8 from our batch received a 4 GPA iirc and it wasn't really outlandish because our school produced the best SEE results nationally 2 years prior to us and best in the province for 2 years straight.

The one's who got their grades heavily inflated were only those who seemed like they might bomb the exam but received B/B+.",1,04-06-2022 09:18,False,neutral,neutral,positive,neutral
v40dqv,Self study garna bani banau. Bachelors ma kaam lagcha.,2,04-06-2022 09:19,False,neutral,neutral,positive,neutral
v40dqv,Afu padna sakdeinan ani aru lai peanut brain re. Haha,-2,04-06-2022 05:59,False,neutral,neutral,neutral,neutral
v40dqv,"True !!
Course ta sidiyo Tara teti majale kei bujiena.",1,08-06-2022 14:46,False,neutral,neutral,neutral,neutral
v40dqv,"timi ta khatrai raichau.. tara veda haru ko pachi na lagi padnu ramro sanga.

Aba bidesh jane vayepachi skill pani sikera janu. All the best..",2,04-06-2022 06:12,False,neutral,positive,positive,positive
v40dqv,Overexposure of the internet but well reality nai tyei ho gotta accept it,1,04-06-2022 03:42,False,neutral,neutral,negative,neutral
v40dqv,Okay uncle,-11,03-06-2022 20:37,False,neutral,neutral,neutral,neutral
v40dqv,they only know how to do demonstration through online platform such as tiktok or Routine of Nepal banda..,-1,04-06-2022 06:12,False,neutral,neutral,neutral,neutral
v40dqv,Keep lying to yourself brother. That's how you cope. Fake it till you make it.,19,03-06-2022 15:04,False,negative,negative,negative,negative
v40dqv,muji nepal ma indian influence etti xa ki gaali ni hindi mai dinxan bhura bhuri haru.,2,03-06-2022 18:19,False,neutral,neutral,negative,neutral
v40dqv,Aaru batch  ni tesari padeko ho 10 ma . Y'all are not first batch chill,-1,03-06-2022 18:52,False,neutral,neutral,positive,neutral
v40dqv,"Vuraharu panda jau, ama bau la tirdeko fees ho waste nafala",1,03-06-2022 20:57,False,neutral,negative,negative,negative
v40dqv,"/u/Gold-Squash2366, Your account has less than -50 Karma. That's a lot. Therefore, your submission has been removed. If you wish to post then increase your Karma count or please contact the moderators.

*I am a bot, and this action was performed automatically. Please [contact the moderators of this subreddit](/message/compose/?to=/r/Nepal) if you have any questions or concerns.*",1,04-06-2022 06:27,False,neutral,neutral,negative,neutral
v40dqv,Agree,1,04-06-2022 10:24,False,neutral,neutral,positive,neutral
v40dqv,"ma aafai class 11 ko ra ma  science student ho, ma samjhauxu",22,03-06-2022 15:04,False,neutral,neutral,negative,neutral
v40dqv,"I will be messaging you in 1 year on [**2023-06-03 14:59:16 UTC**](http://www.wolframalpha.com/input/?i=2023-06-03%2014:59:16%20UTC%20To%20Local%20Time) to remind you of [**this link**](https://www.reddit.com/r/Nepal/comments/v40dqv/many_predicted_this/ib1kz0w/?context=3)

[**4 OTHERS CLICKED THIS LINK**](https://www.reddit.com/message/compose/?to=RemindMeBot&subject=Reminder&message=%5Bhttps%3A%2F%2Fwww.reddit.com%2Fr%2FNepal%2Fcomments%2Fv40dqv%2Fmany_predicted_this%2Fib1kz0w%2F%5D%0A%0ARemindMe%21%202023-06-03%2014%3A59%3A16%20UTC) to send a PM to also be reminded and to reduce spam.

^(Parent commenter can ) [^(delete this message to hide from others.)](https://www.reddit.com/message/compose/?to=RemindMeBot&subject=Delete%20Comment&message=Delete%21%20v40dqv)

*****

|[^(Info)](https://www.reddit.com/r/RemindMeBot/comments/e1bko7/remindmebot_info_v21/)|[^(Custom)](https://www.reddit.com/message/compose/?to=RemindMeBot&subject=Reminder&message=%5BLink%20or%20message%20inside%20square%20brackets%5D%0A%0ARemindMe%21%20Time%20period%20here)|[^(Your Reminders)](https://www.reddit.com/message/compose/?to=RemindMeBot&subject=List%20Of%20Reminders&message=MyReminders%21)|[^(Feedback)](https://www.reddit.com/message/compose/?to=Watchful1&subject=RemindMeBot%20Feedback)|
|-|-|-|-|",4,03-06-2022 14:59,False,neutral,neutral,negative,neutral
v40dqv,Vai taile book payera ni padthis ta ? Dher bahana nabana ya ayera gayera padh .. 11 ma online exam vanera uffrethis aile ayera vetis hainata .. mehenat garnu parxa vai life ma sabai kura yetikai 4 gpa a+ hudena,3,04-06-2022 00:35,False,neutral,neutral,neutral,neutral
v40dqv,"Nice english 😆.
You must've been in the ""english ma dherai marks lyaune group"".",1,08-06-2022 14:42,False,positive,positive,positive,positive
v40dqv,I'm sorry bro I couldn't understand what you mean. Even I should have posted my comment in English,2,04-06-2022 06:47,False,negative,negative,negative,negative
v40dqv,Aaba timi lai sidai Phd ko padayera padna sakdaina vanna milxa ta?,1,06-06-2022 10:29,False,neutral,neutral,neutral,neutral
v40dqv,Yeah i never said that was not true “okay” nai lekhya chu ta maile ni,1,04-06-2022 16:17,False,neutral,neutral,neutral,neutral
v40dqv,"Lol why u have so many downvotes
Looks like boomers and mrr kaa woke millennials haru got offended💀",-4,04-06-2022 06:44,False,negative,negative,negative,negative
v40dqv,"they only how to do demonstration Online through tiktok or Routine of Nepal banda..

Incorrect sentence structure here. I think you missed a certain verb. Better work on your grammar instead of generalizing an entire generation on the internet. Ani RONB? Really??",3,04-06-2022 16:31,False,negative,negative,negative,negative
v40dqv,Yeah same to you bro. Mehnet garera ni aru le Jpt bhanne raexan bhane Mo kei boldina. Aba tmi afu le ta exam ma A+ layayo hola. Desh ko pragati ni dherai garexau hola. Hami jasto loser le Tmro opinion ma point garne saval nai bhayena ni hai?,-1,03-06-2022 15:07,False,neutral,neutral,negative,neutral
v40dqv,Ma pani. 🫂,9,03-06-2022 15:06,False,neutral,neutral,positive,neutral
v40dqv,"I don't really care about it because it's barely affected me lmfao. Normal situation vayeni navayeni my grades haven't declined at all. Would've done better with the previous curriculum though solely because no Nepali writing at all in class 12 management.

I personally benefitted from the circumstances as I was able to prep and take the SAT around the start of 12th. Online gave me so much free time.

I'm only making an objective observation of the circumstances this current batch who were clearly affected by many things. Those who couldn't adapt and those whose teachers sucked at utilizing the alternatives are clearly struggling.",2,04-06-2022 09:05,False,negative,neutral,negative,negative
v40dqv,"Nah bro it's totally ok. We understand your language.
That reply was a satire to other woke members of this sub",1,04-06-2022 06:48,False,neutral,neutral,neutral,neutral
v40dqv,Phd ko padna sake ta ma phd gari halthe ni,1,11-07-2022 11:30,False,neutral,neutral,neutral,neutral
v40dqv,"Yeah I better ask for forgiveness now.
“Darshan uncles and aunties of reddit, I am sorry, it was a joke huhu”",2,04-06-2022 12:55,False,negative,neutral,negative,negative
v40dqv,Mero ta tala ko kera for yr grammar too,0,04-06-2022 16:35,False,neutral,neutral,neutral,neutral
v40dqv,"You are lying if you think everyone would have performed well in SEE. In that batch, nearly 10k students got A+ while it was only a few hundred in the previous batch.",-5,03-06-2022 15:49,False,positive,positive,neutral,positive
v40dqv,Question paper pathau na boru,5,03-06-2022 15:06,False,neutral,neutral,neutral,neutral
v40dqv,Oh. Thanks for clarifying!,3,04-06-2022 06:48,False,positive,positive,positive,positive
v40dqv,Wow mature man on Reddit destroys gen Z using logic.,3,04-06-2022 16:37,False,negative,negative,neutral,negative
v40dqv,"hamro physics ko bhayo final term aaile samma niko parci maths ko, how do i send u photo",6,03-06-2022 15:09,False,neutral,neutral,neutral,neutral
v40dqv,XD,3,05-06-2022 06:31,False,neutral,neutral,neutral,neutral
v40dqv,Kun clz ma padhxau?,1,04-06-2022 05:43,False,neutral,neutral,neutral,neutral
v40dqv,"Bhanna chahanna yar, anonymous

But ktm ma padxu",1,04-06-2022 08:08,False,neutral,neutral,negative,neutral
v40dqv,Eh eh mero ni nika parsi math ko eggjam xa tei bhayera sodheko 😅😆,2,04-06-2022 08:17,False,neutral,neutral,neutral,neutral
v40dqv,Ktm mai ho?,1,04-06-2022 08:26,False,neutral,neutral,neutral,neutral
v40dqv,Wait a minute,2,04-06-2022 10:13,False,neutral,neutral,neutral,neutral
v40dqv,Ahh,1,04-06-2022 08:29,False,neutral,neutral,neutral,neutral
v40dqv,I think I lost my consciousness in the 6th dimensions.,1,04-06-2022 13:55,False,negative,neutral,neutral,neutral
